investor,stock,company,sector,pct,shares,value_idr,type,lf
PT BIO FARMA (Persero),KAEF,KIMIA FARMA Tbk,PHARMACEUTICALS,89.82,4999999999,2309999999538.0,Corporation,Local
PERUSAHAAN PERSEROAN (PERSERO) PT. ASABRI,KAEF,KIMIA FARMA Tbk,PHARMACEUTICALS,4.43,246541600,113902219200.0,Insurance,Local
PT. TAHTRA KERTAJAYA INDONESIA,KAQI,JANTRA GRUPO INDONESIA Tbk,AUTOMOTIVE AND COMPONENTS,78.32,1625792000,141443904000.0,Corporation,Local
SARANAKELOLA INVESTA,KARW,MERATUS JASA PRIMA Tbk,TRANSPORTATION,77.03,452266400,141107116800.0,Corporation,Local
TOMY GORETHA,KARW,MERATUS JASA PRIMA Tbk,TRANSPORTATION,1.51,8851500,2761668000.0,Individual,Local
PT DARBE PUTRA MAKMUR,KAYU,DARMI BERSAUDARA Tbk,WOOD INDUSTRIES,37.46,249114659,4484063862.0,Corporation,Local
ALDO PRATAMA PURNOMO,KAYU,DARMI BERSAUDARA Tbk,WOOD INDUSTRIES,19.75,131351900,2364334200.0,Individual,Local
WAWAN SETYAWAN SE,KAYU,DARMI BERSAUDARA Tbk,WOOD INDUSTRIES,8.55,56836821,1023062778.0,Individual,Local
CGS INTERNATIONAL SECURITIES SINGAPORE PTE LTD,KAYU,DARMI BERSAUDARA Tbk,WOOD INDUSTRIES,4.05,26949400,485089200.0,Insurance/Pension,Foreign
MUHAMMAD BACHTIAR NAPPU ST MT M PHIL PHD,KAYU,DARMI BERSAUDARA Tbk,WOOD INDUSTRIES,2.83,18845800,339224400.0,Individual,Local
JP MORGAN SECURITIES PLC,KAYU,DARMI BERSAUDARA Tbk,WOOD INDUSTRIES,2.45,16263800,292748400.0,Insurance/Pension,Foreign
VALENT PRATAMA PURNOMO,KAYU,DARMI BERSAUDARA Tbk,WOOD INDUSTRIES,2.33,15480500,278649000.0,Individual,Local
SHANDY EFFO KALIM,KAYU,DARMI BERSAUDARA Tbk,WOOD INDUSTRIES,1.61,10708900,192760200.0,Individual,Local
PT VISI KOTA INDONESIA,KBAG,KARYA BERSAMA ANUGERAH Tbk,PROPERTY AND REAL ESTATE,55.47,3965766700,174493734800.0,Corporation,Local
SALIM LIM,KBAG,KARYA BERSAMA ANUGERAH Tbk,PROPERTY AND REAL ESTATE,8.47,605567400,26644965600.0,Individual,Local
MANDIRI INVESTASI BERSAMA PT,KBAG,KARYA BERSAMA ANUGERAH Tbk,PROPERTY AND REAL ESTATE,2.87,205241500,9030626000.0,Corporation,Local
KUNCORO,KBAG,KARYA BERSAMA ANUGERAH Tbk,PROPERTY AND REAL ESTATE,1.23,88000000,3872000000.0,Individual,Local
PT.OMEDATA ELECTRONICS,KBLI,KMI Wire and Cable Tbk,CABLE,49.47,1982392237,634365515840.0,Corporation,Local
REKSA DANA SUCORINVEST EQUITY PRIMA FUND,KBLI,KMI Wire and Cable Tbk,CABLE,4.71,188834700,60427104000.0,Mutual Fund,Local
REKSA DANA SUCORINVEST EQUITY FUND,KBLI,KMI Wire and Cable Tbk,CABLE,4.51,180733100,57834592000.0,Mutual Fund,Local
REKSA DANA SYARIAH SUCORINVEST SHARIA BALANCED FUND,KBLI,KMI Wire and Cable Tbk,CABLE,4.34,173747800,55599296000.0,Mutual Fund,Local
REKSA DANA SUCORINVEST PREMIUM FUND,KBLI,KMI Wire and Cable Tbk,CABLE,4.03,161481500,51674080000.0,Mutual Fund,Local
BNP PARIBAS SINGAPORE BRANCH,KBLI,KMI Wire and Cable Tbk,CABLE,3.99,159701500,51104480000.0,Insurance/Pension,Foreign
REKSA DANA SUCORINVEST SHARIA EQUITY FUND,KBLI,KMI Wire and Cable Tbk,CABLE,3.63,145608800,46594816000.0,Mutual Fund,Local
REKSA DANA SUCORINVEST DANA SEHAT BERIMBANG,KBLI,KMI Wire and Cable Tbk,CABLE,3.16,126807200,40578304000.0,Mutual Fund,Local
REKSA DANA PENDAPATAN TETAP SUCORINVEST STABLE FUND,KBLI,KMI Wire and Cable Tbk,CABLE,2.25,89992900,28797728000.0,Mutual Fund,Local
CACEIS BANK/NON TREATY UCITS CLIENTS,KBLI,KMI Wire and Cable Tbk,CABLE,1.72,68727600,21992832000.0,Insurance/Pension,Foreign
MANOJ PITAMBER NANWANI,KBLI,KMI Wire and Cable Tbk,CABLE,1.62,65042000,20813440000.0,Individual,Local
REKSA DANA SUCORINVEST MAXI FUND,KBLI,KMI Wire and Cable Tbk,CABLE,1.26,50538600,16172352000.0,Mutual Fund,Local
PT. SIBALEC,KBLM,KABELINDO MURNI Tbk,CABLE,40.27,451017200,153345848000.0,Corporation,Local
PT. MESINDO AGUNG NUSANTARA,KBLM,KABELINDO MURNI Tbk,CABLE,34.76,389300000,132362000000.0,Corporation,Local
PT ERDHIKA ELIT SEKURITAS,KBLM,KABELINDO MURNI Tbk,CABLE,6.58,73711600,25061944000.0,Securities Co,Local
"PT BANK RAKYAT INDONESIA (PERSERO), TBK",KBLM,KABELINDO MURNI Tbk,CABLE,2.66,29736000,10110240000.0,Insurance/Pension,Local
THRECIA RAHARJO,KBLM,KABELINDO MURNI Tbk,CABLE,1.21,13500000,4590000000.0,Individual,Local
HAIYANTO,KBLM,KABELINDO MURNI Tbk,CABLE,1.19,13354400,4540496000.0,Individual,Local
PT TEMBAGA MULIA SEMANAN Tbk,KBLM,KABELINDO MURNI Tbk,CABLE,1.17,13059200,4440128000.0,Corporation,Local
LOULOU KARTINI RAHARDJO,KBLM,KABELINDO MURNI Tbk,CABLE,1.12,12500000,4250000000.0,Individual,Local
ELLY SOEPONO,KBLM,KABELINDO MURNI Tbk,CABLE,1.12,12500000,4250000000.0,Individual,Local
DENNIS SARWONO RAHARDJO,KBLM,KABELINDO MURNI Tbk,CABLE,1.12,12500000,4250000000.0,Unknown,Foreign
FLORENCE RAHARJO,KBLM,KABELINDO MURNI Tbk,CABLE,1.12,12500000,4250000000.0,Unknown,Foreign
HARRY SUTOMO RAHARJO,KBLM,KABELINDO MURNI Tbk,CABLE,1.12,12500000,4250000000.0,Unknown,Foreign
TJONG LEONARD JUWONDO,KBLM,KABELINDO MURNI Tbk,CABLE,1.09,12200000,4148000000.0,Individual,Local
PT REKSA PUSPITA KARYA,KBLV,FIRST MEDIA Tbk,TELECOMUNICATION,33.76,588167378,61757574690.0,Corporation,Local
"TRIJAYA PUTRA MULIA, PT",KBLV,FIRST MEDIA Tbk,TELECOMUNICATION,9.2,160276213,16829002365.0,Corporation,Local
"KHARISMA BUANA NUSANTARA, PT",KBLV,FIRST MEDIA Tbk,TELECOMUNICATION,4.0,69686716,7317105180.0,Corporation,Local
"SANGGRAHA NUSA RAYA, PT",KBLV,FIRST MEDIA Tbk,TELECOMUNICATION,2.83,49238284,5170019820.0,Corporation,Local
SIAUW YUNUS SUBANDI,KBLV,FIRST MEDIA Tbk,TELECOMUNICATION,2.62,45627100,4790845500.0,Individual,Local
JOHANES SOETIKNO,KBLV,FIRST MEDIA Tbk,TELECOMUNICATION,1.37,23844000,2503620000.0,Individual,Local
JAKSA AGUNG MUDA BIDANG TINDAK PIDANA KHUSUS KEJAKSAAN REPUBLIK INDONESIA KEJAKSAAN REPUBLIK INDONESIA,KBRI,KERTAS BASUKI RACHMAT INDONESIA Tbk,PULP & PAPER,75.25,6537394329,326869716450.0,Others,Local
RENNIER A. R LATIEF,KBRI,KERTAS BASUKI RACHMAT INDONESIA Tbk,PULP & PAPER,3.1,269549689,13477484450.0,Individual,Local
BAMBANG PRANOWO,KBRI,KERTAS BASUKI RACHMAT INDONESIA Tbk,PULP & PAPER,2.3,200000000,10000000000.0,Individual,Local
DANA PENSIUN PERHUTANI,KBRI,KERTAS BASUKI RACHMAT INDONESIA Tbk,PULP & PAPER,1.32,115000000,5750000000.0,Pension Fund,Local
Cipta Purnama,KBRI,KERTAS BASUKI RACHMAT INDONESIA Tbk,PULP & PAPER,1.07,92916000,4645800000.0,Unknown,Foreign
"KITASUBUR UTAMA, PT",KDSI,KEDAWUNG SETIA INDUSTRIAL Tbk,PULP & PAPER,78.52,1271968800,574929897600.0,Corporation,Local
PERMADI AL SUHARTO.BSC,KDSI,KEDAWUNG SETIA INDUSTRIAL Tbk,PULP & PAPER,5.57,90288000,40810176000.0,Individual,Local
PT. HOKI INVESTASI SEJATI,KDSI,KEDAWUNG SETIA INDUSTRIAL Tbk,PULP & PAPER,5.0,80981800,36603773600.0,Corporation,Local
SUKARTO BUJUNG,KDSI,KEDAWUNG SETIA INDUSTRIAL Tbk,PULP & PAPER,3.71,60116900,27172838800.0,Individual,Local
TJIPTO WIRAHADIKUSUMAH W,KDSI,KEDAWUNG SETIA INDUSTRIAL Tbk,PULP & PAPER,1.1,17831000,8059612000.0,Individual,Local
PUTRASAKTI MANDIRI PT,KDTN,PURI SENTUL PERMAI Tbk,"RESTAURANT, HOTEL & TOURISM",38.04,475500000,463612500000.0,Corporation,Local
PT CAHAYASAKTI INVESTINDO SUKSES TBK,KDTN,PURI SENTUL PERMAI Tbk,"RESTAURANT, HOTEL & TOURISM",24.0,300000000,292500000000.0,Corporation,Local
"INTAN PERDANA SUKSES, PT",KDTN,PURI SENTUL PERMAI Tbk,"RESTAURANT, HOTEL & TOURISM",24.0,300000000,292500000000.0,Corporation,Local
TAN CHIAN HOK,KDTN,PURI SENTUL PERMAI Tbk,"RESTAURANT, HOTEL & TOURISM",1.72,21518000,20980050000.0,Individual,Local
UNI PAWITRASARI,KDTN,PURI SENTUL PERMAI Tbk,"RESTAURANT, HOTEL & TOURISM",1.7,21200000,20670000000.0,Individual,Local
YEPING HUANG,KDTN,PURI SENTUL PERMAI Tbk,"RESTAURANT, HOTEL & TOURISM",1.24,15507800,15120105000.0,Individual,Foreign
PARAMATA INDAH LESTARI,KEEN,KENCANA ENERGI LESTARI Tbk,"OTHERS - INFRASTRUCTURE, UTILITIES & TRANSPORTATIO",30.3,1110920000,972055000000.0,Corporation,Local
"TEPCO Renewable Power, Incorporated",KEEN,KENCANA ENERGI LESTARI Tbk,"OTHERS - INFRASTRUCTURE, UTILITIES & TRANSPORTATIO",25.0,916578200,802005925000.0,Corporation,Foreign
HENRY MAKNAWI,KEEN,KENCANA ENERGI LESTARI Tbk,"OTHERS - INFRASTRUCTURE, UTILITIES & TRANSPORTATIO",11.02,404114413,353600111375.0,Individual,Local
JEANNY MAKNAWI JOE,KEEN,KENCANA ENERGI LESTARI Tbk,"OTHERS - INFRASTRUCTURE, UTILITIES & TRANSPORTATIO",5.0,183315763,160401292625.0,Individual,Local
JOHAN MAKNAWI,KEEN,KENCANA ENERGI LESTARI Tbk,"OTHERS - INFRASTRUCTURE, UTILITIES & TRANSPORTATIO",4.28,156918022,137303269250.0,Individual,Local
MYRNA A A RUMENGAN,KEEN,KENCANA ENERGI LESTARI Tbk,"OTHERS - INFRASTRUCTURE, UTILITIES & TRANSPORTATIO",3.65,133943000,117200125000.0,Individual,Local
EDDY MAKNAWI,KEEN,KENCANA ENERGI LESTARI Tbk,"OTHERS - INFRASTRUCTURE, UTILITIES & TRANSPORTATIO",3.0,109989552,96240858000.0,Individual,Local
SURYA SINAR MENTARI PT,KEEN,KENCANA ENERGI LESTARI Tbk,"OTHERS - INFRASTRUCTURE, UTILITIES & TRANSPORTATIO",2.08,76109600,66595900000.0,Corporation,Local
RATNA MAKNAWI,KEEN,KENCANA ENERGI LESTARI Tbk,"OTHERS - INFRASTRUCTURE, UTILITIES & TRANSPORTATIO",2.05,75185188,65787039500.0,Individual,Local
PT MAJU SUBUR MAKMUR,KEEN,KENCANA ENERGI LESTARI Tbk,"OTHERS - INFRASTRUCTURE, UTILITIES & TRANSPORTATIO",1.7,62146461,54378153375.0,Corporation,Local
RUSMIN CAHYADI,KEEN,KENCANA ENERGI LESTARI Tbk,"OTHERS - INFRASTRUCTURE, UTILITIES & TRANSPORTATIO",1.13,41393400,36219225000.0,Individual,Local
"GARUDAFOOD PUTRA PUTRI JAYA TBK, PT",KEJU,MULIA BOGA RAYA Tbk,FOOD & BEVERAGES,66.07,3716642250,1969820392500.0,Corporation,Local
BEL,KEJU,MULIA BOGA RAYA Tbk,FOOD & BEVERAGES,22.5,1265668950,670804543500.0,Corporation,Foreign
PT. CITRA SEJATI SENTOSA,KEJU,MULIA BOGA RAYA Tbk,FOOD & BEVERAGES,4.0,225000000,119250000000.0,Corporation,Local
PT GARUDA TIMUR PACIFIC,KEJU,MULIA BOGA RAYA Tbk,FOOD & BEVERAGES,1.35,75937500,40246875000.0,Corporation,Local
PT FAJAR SEJAHTERA MANDIRI NUSANTARA,KETR,KETROSDEN TRIASMITRA Tbk,TELECOMUNICATION,56.53,1606165931,645678704262.0,Corporation,Local
PT GEMA LINTAS BENUA,KETR,KETROSDEN TRIASMITRA Tbk,TELECOMUNICATION,17.99,511173287,205491661374.0,Corporation,Local
RUDY SUSANTO,KETR,KETROSDEN TRIASMITRA Tbk,TELECOMUNICATION,1.7,48250000,19396500000.0,Individual,Local
"UBS AG, LONDON",KETR,KETROSDEN TRIASMITRA Tbk,TELECOMUNICATION,1.49,42380300,17036880600.0,Insurance/Pension,Foreign
SCG DECOR PUBLIC COMPANY LIMITED,KIAS,KERAMIKA INDONESIA ASSOSIASI Tbk,"CERAMICS, GLASS, PORCELAIN",92.04,13741458453,288570627513.0,Corporation,Foreign
MITRA INVESTINDO MULTICORPORA PT,KIAS,KERAMIKA INDONESIA ASSOSIASI Tbk,"CERAMICS, GLASS, PORCELAIN",1.93,288140200,6050944200.0,Unknown,Foreign
PT. HP CAPITAL RESOURCES,KIAS,KERAMIKA INDONESIA ASSOSIASI Tbk,"CERAMICS, GLASS, PORCELAIN",1.78,265813300,5582079300.0,Corporation,Local
PT KEDAWUNG SUBUR,KICI,KEDAUNG INDAH CAN Tbk,HOUSEWARE,43.62,120390280,22272201800.0,Corporation,Local
D.K LIM & SONS INVESTMENT PTE LTD,KICI,KEDAUNG INDAH CAN Tbk,HOUSEWARE,31.4,86664000,16032840000.0,Unknown,Foreign
AGUS NURSALIM,KICI,KEDAUNG INDAH CAN Tbk,HOUSEWARE,4.6,12696000,2348760000.0,Unknown,Foreign
RUDY EFENDY,KICI,KEDAUNG INDAH CAN Tbk,HOUSEWARE,2.17,6000000,1110000000.0,Individual,Local
Ashley Group Limited,KICI,KEDAUNG INDAH CAN Tbk,HOUSEWARE,1.21,3328000,615680000.0,Corporation,Foreign
MU MIN ALI GUNAWAN,KIJA,KAWASAN INDUSTRI JABABEKA Tbk,PROPERTY AND REAL ESTATE,21.09,4391370788,764098517112.0,Individual,Local
ISLAMIC DEVELOPMENT BANK,KIJA,KAWASAN INDUSTRI JABABEKA Tbk,PROPERTY AND REAL ESTATE,11.53,2400359372,417662530728.0,Insurance/Pension,Foreign
UBS AG SINGAPORE BRANCH,KIJA,KAWASAN INDUSTRI JABABEKA Tbk,PROPERTY AND REAL ESTATE,3.84,800703377,139322387598.0,Insurance/Pension,Foreign
INTELLITOP FINANCE LIMITED,KIJA,KAWASAN INDUSTRI JABABEKA Tbk,PROPERTY AND REAL ESTATE,3.78,788149632,137138035968.0,Unknown,Foreign
AIDA GARNIDA,KIJA,KAWASAN INDUSTRI JABABEKA Tbk,PROPERTY AND REAL ESTATE,2.79,580637352,101030899248.0,Individual,Local
PT KMI CIOUD INDONESIA,KIJA,KAWASAN INDUSTRI JABABEKA Tbk,PROPERTY AND REAL ESTATE,2.32,482498276,83954700024.0,Corporation,Local
REKSA DANA PRATAMA DANA DINAMIS SAHAM,KIJA,KAWASAN INDUSTRI JABABEKA Tbk,PROPERTY AND REAL ESTATE,2.27,472385819,82195132506.0,Mutual Fund,Local
KIWANTARA MARDJUKI,KIJA,KAWASAN INDUSTRI JABABEKA Tbk,PROPERTY AND REAL ESTATE,1.4,291307775,50687552850.0,Individual,Local
HENGKI MARDJUKI,KIJA,KAWASAN INDUSTRI JABABEKA Tbk,PROPERTY AND REAL ESTATE,1.27,264059219,45946304106.0,Individual,Local
GOVERNMENT OF NORWAY,KIJA,KAWASAN INDUSTRI JABABEKA Tbk,PROPERTY AND REAL ESTATE,1.24,258043200,44899516800.0,Others,Foreign
CHRISTINE DEWI,KIJA,KAWASAN INDUSTRI JABABEKA Tbk,PROPERTY AND REAL ESTATE,1.23,256196659,44578218666.0,Individual,Local
PT. KINOLOGI SEMESTA NUSANTARA,KIJA,KAWASAN INDUSTRI JABABEKA Tbk,PROPERTY AND REAL ESTATE,1.11,230160020,40047843480.0,Corporation,Local
RICHARD BUDI GUNAWAN,KIJA,KAWASAN INDUSTRI JABABEKA Tbk,PROPERTY AND REAL ESTATE,1.04,216693118,37704602532.0,Individual,Local
"PANIN SEKURITAS Tbk, PT",KIJA,KAWASAN INDUSTRI JABABEKA Tbk,PROPERTY AND REAL ESTATE,1.04,216328530,37641164220.0,Securities Co,Local
PT. BERKAT MITRA SEMESTA,KIJA,KAWASAN INDUSTRI JABABEKA Tbk,PROPERTY AND REAL ESTATE,1.03,213750000,37192500000.0,Corporation,Local
PT JAPARTO SUKSES MANDIRI,KING,HOFFMEN CLEANINDO Tbk,"OTHERS - TRADE, SERVICES & INVESTMENT",76.84,2000000000,508000000000.0,Corporation,Local
CV POHON MANGGA SEJAHTERA,KING,HOFFMEN CLEANINDO Tbk,"OTHERS - TRADE, SERVICES & INVESTMENT",5.49,143000000,36322000000.0,Corporation,Local
PT ASWIN PUTRA HARMOTEKNIK,KING,HOFFMEN CLEANINDO Tbk,"OTHERS - TRADE, SERVICES & INVESTMENT",4.11,107000000,27178000000.0,Corporation,Local
PT BINTANG TIMUR INVESTAMA,KING,HOFFMEN CLEANINDO Tbk,"OTHERS - TRADE, SERVICES & INVESTMENT",3.09,80400000,20421600000.0,Corporation,Local
ALVA KHOMAS,KING,HOFFMEN CLEANINDO Tbk,"OTHERS - TRADE, SERVICES & INVESTMENT",1.67,43545400,11060531600.0,Individual,Local
EDDY JAPARTO,KING,HOFFMEN CLEANINDO Tbk,"OTHERS - TRADE, SERVICES & INVESTMENT",1.54,40000000,10160000000.0,Individual,Local
RUDY JAPARTO,KING,HOFFMEN CLEANINDO Tbk,"OTHERS - TRADE, SERVICES & INVESTMENT",1.54,40000000,10160000000.0,Individual,Local
PT. ADITHANA KARYA SENTOSA,KING,HOFFMEN CLEANINDO Tbk,"OTHERS - TRADE, SERVICES & INVESTMENT",1.28,33384600,8479688400.0,Corporation,Local
ALDRIN YANI,KING,HOFFMEN CLEANINDO Tbk,"OTHERS - TRADE, SERVICES & INVESTMENT",1.26,32692300,8303844200.0,Individual,Local
PT KINO INVESTINDO,KINO,KINO INDONESIA Tbk,COSMETICS AND HOUSEHOLD,79.0,1128584800,1320444216000.0,Corporation,Local
"HARRY SANUSI,DRS",KINO,KINO INDONESIA Tbk,COSMETICS AND HOUSEHOLD,4.04,57775257,67597050690.0,Individual,Local
UOB KAY HIAN PRIVATE LIMITED,KINO,KINO INDONESIA Tbk,COSMETICS AND HOUSEHOLD,3.55,50657143,59268857310.0,Securities Co,Foreign
"KINO INDONESIA TBK, PT",KINO,KINO INDONESIA Tbk,COSMETICS AND HOUSEHOLD,3.48,49752600,58210542000.0,Corporation,Local
HARRIS SANUSI,KINO,KINO INDONESIA Tbk,COSMETICS AND HOUSEHOLD,3.35,47841000,55973970000.0,Individual,Local
NUSANTARA FMCG LIMITED,KINO,KINO INDONESIA Tbk,COSMETICS AND HOUSEHOLD,2.23,31837000,37249290000.0,Insurance/Pension,Foreign
RUDY BONGSO,KINO,KINO INDONESIA Tbk,COSMETICS AND HOUSEHOLD,1.4,20000000,23400000000.0,Individual,Local
PT ARTAV MOBILE INDONESIA,KIOS,KIOSON KOMERSIAL INDONESIA Tbk,COMPUTER AND SERVICES,32.56,350300000,34679700000.0,Corporation,Local
PT. PRAMBANAN INVESTASI SUKSES,KIOS,KIOSON KOMERSIAL INDONESIA Tbk,COMPUTER AND SERVICES,7.75,83369534,8253583866.0,Corporation,Local
REKSA DANA SYARIAH PACIFIC SAHAM SYARIAH III,KIOS,KIOSON KOMERSIAL INDONESIA Tbk,COMPUTER AND SERVICES,4.04,43472300,4303757700.0,Mutual Fund,Local
"CAPITAL LIFE SYARIAH, PT",KIOS,KIOSON KOMERSIAL INDONESIA Tbk,COMPUTER AND SERVICES,3.25,35000000,3465000000.0,Insurance,Local
PT SEMESTA DAYA MAKMUR,KIOS,KIOSON KOMERSIAL INDONESIA Tbk,COMPUTER AND SERVICES,2.3,24700000,2445300000.0,Corporation,Local
KOKARJADI CHANDRA,KIOS,KIOSON KOMERSIAL INDONESIA Tbk,COMPUTER AND SERVICES,1.86,20000000,1980000000.0,Individual,Local
ERLY ONGGARA,KIOS,KIOSON KOMERSIAL INDONESIA Tbk,COMPUTER AND SERVICES,1.86,20000000,1980000000.0,Individual,Local
KINGSWOOD UNION CORPORATION,KIOS,KIOSON KOMERSIAL INDONESIA Tbk,COMPUTER AND SERVICES,1.86,20000000,1980000000.0,Others,Foreign
PT KARYA INVESTASI BERSAMA,KIOS,KIOSON KOMERSIAL INDONESIA Tbk,COMPUTER AND SERVICES,1.81,19500000,1930500000.0,Corporation,Local
TONY WIJAYA,KIOS,KIOSON KOMERSIAL INDONESIA Tbk,COMPUTER AND SERVICES,1.39,14984000,1483416000.0,Individual,Local
REKSA DANA PACIFIC SAHAM SYARIAH,KIOS,KIOSON KOMERSIAL INDONESIA Tbk,COMPUTER AND SERVICES,1.25,13476000,1334124000.0,Mutual Fund,Local
GRAFI1NDO KARYA NUSANTARA PT,KJEN,KRIDA JARINGAN NUSANTARA Tbk,TRANSPORTATION,52.5,262500000,29662500000.0,Unknown,Foreign
REKSA DANA NARADA SAHAM INDONESIA,KJEN,KRIDA JARINGAN NUSANTARA Tbk,TRANSPORTATION,5.92,29615300,3346528900.0,Mutual Fund,Local
PETRUS DARUYANNI PECTRUS DARUYANI,KJEN,KRIDA JARINGAN NUSANTARA Tbk,TRANSPORTATION,4.55,22750000,2570750000.0,Individual,Local
VALENTINA KUSUMAWATI W,KJEN,KRIDA JARINGAN NUSANTARA Tbk,TRANSPORTATION,4.2,21000000,2373000000.0,Individual,Local
INGRID KARTIKAWATI W.D.,KJEN,KRIDA JARINGAN NUSANTARA Tbk,TRANSPORTATION,4.2,21000000,2373000000.0,Individual,Local
ERIKA NURALIZA,KJEN,KRIDA JARINGAN NUSANTARA Tbk,TRANSPORTATION,3.6,18000000,2034000000.0,Individual,Local
"CATUR SENTOSA ADIPRANA TBK, PT",KKES,KUSUMA KEMINDO SENTOSA Tbk,CHEMICALS,40.8,612000000,20808000000.0,Corporation,Local
PT BUDILESTARI SENTOSA,KKES,KUSUMA KEMINDO SENTOSA Tbk,CHEMICALS,11.2,168000000,5712000000.0,Corporation,Local
"KIKI RUSMIN SADRACH, DRS",KKES,KUSUMA KEMINDO SENTOSA Tbk,CHEMICALS,10.67,160036000,5441224000.0,Individual,Local
NIKE HERMANSYAH,KKES,KUSUMA KEMINDO SENTOSA Tbk,CHEMICALS,2.74,41060200,1396046800.0,Individual,Local
CARFI SOMALA,KKES,KUSUMA KEMINDO SENTOSA Tbk,CHEMICALS,2.57,38611100,1312777400.0,Individual,Local
YOHANES ARIF LUKMAN,KKES,KUSUMA KEMINDO SENTOSA Tbk,CHEMICALS,1.62,24359500,828223000.0,Individual,Local
ARYA PRADANA SETIADHARMA,KKES,KUSUMA KEMINDO SENTOSA Tbk,CHEMICALS,1.2,17972000,611048000.0,Individual,Local
RETNO WIDYATI HARSONO,KKES,KUSUMA KEMINDO SENTOSA Tbk,CHEMICALS,1.17,17500000,595000000.0,Individual,Local
FELICIA WIENDRATY HARSONO,KKES,KUSUMA KEMINDO SENTOSA Tbk,CHEMICALS,1.07,16000000,544000000.0,Individual,Local
ENERGY COLLIER PRIVATE LIMITED,KKGI,RESOURCE ALAM INDONESIA Tbk,COAL MINING,37.11,1855447105,664250063590.0,Corporation,Foreign
PT. SEJAHTERA JAYA CITA,KKGI,RESOURCE ALAM INDONESIA Tbk,COAL MINING,27.83,1391585329,498187547782.0,Corporation,Local
SINAR NUSANTARA SDN. BHD.,KKGI,RESOURCE ALAM INDONESIA Tbk,COAL MINING,8.27,413611772,148073014376.0,Corporation,Foreign
LX_INTERNATIONAL (SINGAPORE) PTE.LTD,KKGI,RESOURCE ALAM INDONESIA Tbk,COAL MINING,5.21,260372700,93213426600.0,Corporation,Foreign
JANTOCO HOLDINGS SDN. BHD.,KKGI,RESOURCE ALAM INDONESIA Tbk,COAL MINING,3.23,161367831,57769683498.0,Corporation,Foreign
PT RESOURCE ALAM INDONESIA TBK,KKGI,RESOURCE ALAM INDONESIA Tbk,COAL MINING,2.53,126670600,45348074800.0,Corporation,Local
AGATHA AQUILINA SILO,KKGI,RESOURCE ALAM INDONESIA Tbk,COAL MINING,3.03,151544844,54253054152.0,Individual,Local
SATIA PRIOSOETANTO,KKGI,RESOURCE ALAM INDONESIA Tbk,COAL MINING,1.87,93492900,33470458200.0,Unknown,Foreign
KURNYATJAN SAKTI EFENDIE,KLAS,PELAYARAN KURNIA LAUTAN SEMESTA Tbk,TRANSPORTATION,30.43,1109028645,87613262955.0,Individual,Local
PT LADANG IRA PANEN,KLBF,KALBE FARMA Tbk,PHARMACEUTICALS,10.47,4903185740,4756090167800.0,Corporation,Local
PT GIRA SOLE PRIMA,KLBF,KALBE FARMA Tbk,PHARMACEUTICALS,10.31,4824509485,4679774200450.0,Corporation,Local
PT SANTA SEHA SANADI,KLBF,KALBE FARMA Tbk,PHARMACEUTICALS,10.08,4718121940,4576578281800.0,Corporation,Local
PT LUCASTA MURNING CEMERLANG,KLBF,KALBE FARMA Tbk,PHARMACEUTICALS,9.48,4439895440,4306698576800.0,Corporation,Local
PT DIPTANALA BAHANA,KLBF,KALBE FARMA Tbk,PHARMACEUTICALS,9.3,4352057040,4221495328800.0,Corporation,Local
PT BINA ARTA CHARISMA,KLBF,KALBE FARMA Tbk,PHARMACEUTICALS,8.21,3844639040,3729299868800.0,Corporation,Local
PT GRIYA INSANI CAKRA SADAYA,KLBF,KALBE FARMA Tbk,PHARMACEUTICALS,3.43,1605399500,1557237515000.0,Corporation,Local
KALBE FARMA TBK PT,KLBF,KALBE FARMA Tbk,PHARMACEUTICALS,2.81,1313547630,1274141201100.0,Corporation,Local
"HSBC-FUND SERVICES, THE OVERLOOK PARTNERS FUND L.P.",KLBF,KALBE FARMA Tbk,PHARMACEUTICALS,2.44,1142651400,1108371858000.0,Mutual Fund,Foreign
DJS KETENAGAKERJAAN PROGRAM JAMINAN HARI TUA,KLBF,KALBE FARMA Tbk,PHARMACEUTICALS,2.01,939056200,910884514000.0,Insurance,Local
GOVERNMENT OF NORWAY,KLBF,KALBE FARMA Tbk,PHARMACEUTICALS,1.24,579092800,561720016000.0,Others,Foreign
PT. SAMICO CAPITAL UTAMA MULIA,KLIN,KLINKO KARYA IMAJI Tbk,HOUSEWARE,65.56,857254398,125159142108.0,Corporation,Local
PT. WIDJAJA BERKAT GEMILANG,KLIN,KLINKO KARYA IMAJI Tbk,HOUSEWARE,19.54,255481802,37300343092.0,Corporation,Local
DIGITAL PRAJA MAKAYASA,KLIN,KLINKO KARYA IMAJI Tbk,HOUSEWARE,5.48,71624800,10457220800.0,Corporation,Local
RAYMON YONARTO,KLIN,KLINKO KARYA IMAJI Tbk,HOUSEWARE,2.65,34684200,5063893200.0,Individual,Local
PT DIMA INVESTINDO,KMDS,KURNIAMITRA DUTA SENTOSA Tbk,FOOD & BEVERAGES,55.0,440000100,257400058500.0,Corporation,Local
PT MIKI OJISAN INDOMITRA,KMDS,KURNIAMITRA DUTA SENTOSA Tbk,FOOD & BEVERAGES,19.76,158050511,92459548935.0,Corporation,Local
PEI-YI LIU TAMMY LIU,KMDS,KURNIAMITRA DUTA SENTOSA Tbk,FOOD & BEVERAGES,4.26,34083700,19938964500.0,Individual,Foreign
HENGKY WIJAYA,KMDS,KURNIAMITRA DUTA SENTOSA Tbk,FOOD & BEVERAGES,2.69,21553720,12608926200.0,Individual,Local
LIM SOI SWEE,KMDS,KURNIAMITRA DUTA SENTOSA Tbk,FOOD & BEVERAGES,2.49,19894200,11638107000.0,Individual,Local
DRS SURONO SUBEKTI,KMDS,KURNIAMITRA DUTA SENTOSA Tbk,FOOD & BEVERAGES,2.27,18134900,10608916500.0,Individual,Local
RIONALDO THEDYARDI,KMDS,KURNIAMITRA DUTA SENTOSA Tbk,FOOD & BEVERAGES,2.24,17946900,10498936500.0,Individual,Local
CHI YIN PETER WONG,KMDS,KURNIAMITRA DUTA SENTOSA Tbk,FOOD & BEVERAGES,1.39,11108500,6498472500.0,Individual,Foreign
Maria Lie,KMDS,KURNIAMITRA DUTA SENTOSA Tbk,FOOD & BEVERAGES,1.09,8707482,5093876970.0,Individual,Local
HSF (S) PTE LTD,KMTR,KIRANA MEGATARA Tbk,OTHERS - MISCELLANENEOUS INDUSTRY,62.5,5134603987,1314458620672.0,Corporation,Foreign
TRIPUTRA PERSADA MEGATARA PT.,KMTR,KIRANA MEGATARA Tbk,OTHERS - MISCELLANENEOUS INDUSTRY,30.0,2464609474,630940025344.0,Corporation,Local
DEUTSCHE BK AG (PRIVATE BANKING) SPORE WM CLIENT,KMTR,KIRANA MEGATARA Tbk,OTHERS - MISCELLANENEOUS INDUSTRY,2.43,200000000,51200000000.0,Insurance/Pension,Foreign
BANK OF SINGAPORE LIMITED,KMTR,KIRANA MEGATARA Tbk,OTHERS - MISCELLANENEOUS INDUSTRY,2.06,169492900,43390182400.0,Insurance/Pension,Foreign
DBS BANK LTD.,KMTR,KIRANA MEGATARA Tbk,OTHERS - MISCELLANENEOUS INDUSTRY,2.02,165938800,42480332800.0,Insurance/Pension,Foreign
PT KOBEXINDO INVESTAMA,KOBX,KOBEXINDO TRACTORS Tbk,WHOLESALE (DURABLE & NON DURABLE GOODS),89.45,2032714700,268318340400.0,Corporation,Local
"GADING DANALESTARI, PT",KOBX,KOBEXINDO TRACTORS Tbk,WHOLESALE (DURABLE & NON DURABLE GOODS),3.88,88215500,11644446000.0,Corporation,Local
PT EXA NUSA PERSADA,KOCI,KOKOH EXA NUSANTARA Tbk,PROPERTY AND REAL ESTATE,49.33,2203710000,231389550000.0,Corporation,Local
PT KOKOH ANUGERAH NUSANTARA,KOCI,KOKOH EXA NUSANTARA Tbk,PROPERTY AND REAL ESTATE,29.6,1322260000,138837300000.0,Corporation,Local
ISACK UTOMO,KOCI,KOKOH EXA NUSANTARA Tbk,PROPERTY AND REAL ESTATE,4.91,219300000,23026500000.0,Individual,Local
HOKKY HANDOJO,KOCI,KOKOH EXA NUSANTARA Tbk,PROPERTY AND REAL ESTATE,2.68,119700000,12568500000.0,Individual,Local
KEVIN WIBOWO,KOCI,KOKOH EXA NUSANTARA Tbk,PROPERTY AND REAL ESTATE,2.58,115295838,12106062990.0,Individual,Local
PIETER H SOETARDJI,KOCI,KOKOH EXA NUSANTARA Tbk,PROPERTY AND REAL ESTATE,1.85,82620000,8675100000.0,Individual,Local
SCG DISTRIBUTION COMPANY LIMITED,KOIN,KOKOH INTI AREBAMA Tbk,RETAIL TRADE,90.62,888836488,73773428504.0,Corporation,Foreign
PINKY NK,KOIN,KOKOH INTI AREBAMA Tbk,RETAIL TRADE,3.24,31754000,2635582000.0,Individual,Local
MANOJ PITAMBER NANWANI,KOIN,KOKOH INTI AREBAMA Tbk,RETAIL TRADE,1.8,17620500,1462501500.0,Individual,Local
GAO JING,KOKA,KOKA INDONESIA Tbk,CONSTRUCTION,42.75,1223220000,221402820000.0,Individual,Foreign
PT KREATIF KONSTRUKSI INDONESIA,KOKA,KOKA INDONESIA Tbk,CONSTRUCTION,24.75,708180000,128180580000.0,Corporation,Local
LING SUN,KOKA,KOKA INDONESIA Tbk,CONSTRUCTION,5.6,160097900,28977719900.0,Individual,Foreign
JINFENG GAO,KOKA,KOKA INDONESIA Tbk,CONSTRUCTION,5.4,154597840,27982209040.0,Individual,Foreign
FATHI,KOKA,KOKA INDONESIA Tbk,CONSTRUCTION,2.05,58599000,10606419000.0,Individual,Local
QIULING SHAO,KOKA,KOKA INDONESIA Tbk,CONSTRUCTION,1.93,55087060,9970757860.0,Individual,Foreign
"DASABINA ADITYASARANA, PT",KONI,PERDANA BANGUN PUSAKA Tbk,OTHER SECTORS,31.26,97520000,140916400000.0,Unknown,Foreign
LUKMAN KOLIM,KONI,PERDANA BANGUN PUSAKA Tbk,OTHER SECTORS,20.84,65014000,93945230000.0,Individual,Local
L ROSWITA,KONI,PERDANA BANGUN PUSAKA Tbk,OTHER SECTORS,6.52,20338000,29388410000.0,Individual,Local
SYLVIA LUKMAN,KONI,PERDANA BANGUN PUSAKA Tbk,OTHER SECTORS,5.0,15600000,22542000000.0,Individual,Local
EVELYN,KONI,PERDANA BANGUN PUSAKA Tbk,OTHER SECTORS,5.0,15600000,22542000000.0,Individual,Local
SUGIANTO KOLIM,KONI,PERDANA BANGUN PUSAKA Tbk,OTHER SECTORS,5.0,15600000,22542000000.0,Individual,Local
SUSANTO KOLIM,KONI,PERDANA BANGUN PUSAKA Tbk,OTHER SECTORS,5.0,15600000,22542000000.0,Individual,Local
NIRWANA,KONI,PERDANA BANGUN PUSAKA Tbk,OTHER SECTORS,4.92,15345000,22173525000.0,Individual,Local
MEGAWATY RATNA,KONI,PERDANA BANGUN PUSAKA Tbk,OTHER SECTORS,4.92,15345000,22173525000.0,Individual,Local
PT. INDOLIFE PENSIONTAMA,KONI,PERDANA BANGUN PUSAKA Tbk,OTHER SECTORS,3.99,12460000,18004700000.0,Insurance,Local
DEWI SHINTA,KONI,PERDANA BANGUN PUSAKA Tbk,OTHER SECTORS,2.36,7350000,10620750000.0,Individual,Local
ROSANNA IRAWAN,KONI,PERDANA BANGUN PUSAKA Tbk,OTHER SECTORS,2.11,6585300,9515758500.0,Individual,Local
EVE IRAWAN,KONI,PERDANA BANGUN PUSAKA Tbk,OTHER SECTORS,2.08,6491300,9379928500.0,Individual,Local
