investor,stock,company,sector,pct,shares,value_idr,type,lf
PT PROFITAMA HASIL INDAH,PSAT,PANCARAN SAMUDERA TRANSPORT Tbk,TRANSPORTATION,60.35,894600000,800667000000.0,Corporation,Local
PT SURYA MITRA PANCARAN,PSAT,PANCARAN SAMUDERA TRANSPORT Tbk,TRANSPORTATION,24.65,365400000,327033000000.0,Corporation,Local
PT. BENTUK KARYA NUSANTARA,PSAT,PANCARAN SAMUDERA TRANSPORT Tbk,TRANSPORTATION,3.08,45700000,40901500000.0,Corporation,Local
PT WARNA CIPTA KARYA,PSAT,PANCARAN SAMUDERA TRANSPORT Tbk,TRANSPORTATION,2.72,40253000,36026435000.0,Corporation,Local
PT SEGARA ARTHA UTAMA,PSAT,PANCARAN SAMUDERA TRANSPORT Tbk,TRANSPORTATION,2.1,31167600,27895002000.0,Corporation,Local
PT PRASIDHA,PSDN,PRASIDHA ANEKA NIAGA Tbk,FOOD & BEVERAGES,47.0,676830145,88664748995.0,Corporation,Local
IGIANTO JOE,PSDN,PRASIDHA ANEKA NIAGA Tbk,FOOD & BEVERAGES,18.92,272378790,35681621490.0,Individual,Local
"ANEKA BUMI PRASIDHA, PT",PSDN,PRASIDHA ANEKA NIAGA Tbk,FOOD & BEVERAGES,9.48,136500000,17881500000.0,Corporation,Local
"ANEKA AGROPRASIDHA, PT",PSDN,PRASIDHA ANEKA NIAGA Tbk,FOOD & BEVERAGES,7.92,114000000,14934000000.0,Corporation,Local
AGUS SOEGIARTO,PSDN,PRASIDHA ANEKA NIAGA Tbk,FOOD & BEVERAGES,4.58,65933333,8637266623.0,Individual,Local
"Aneka Sumber Kumala, PT",PSDN,PRASIDHA ANEKA NIAGA Tbk,FOOD & BEVERAGES,1.88,27028500,3540733500.0,Corporation,Local
PT ABA JAYAABADI,PSDN,PRASIDHA ANEKA NIAGA Tbk,FOOD & BEVERAGES,1.69,24315500,3185330500.0,Corporation,Local
PT JALINANKASIH SESAMA,PSGO,PALMA SERASIH Tbk,PLANTATION,43.38,8177906900,1602869752400.0,Corporation,Local
"SERASIH HOLDICO, PT",PSGO,PALMA SERASIH Tbk,PLANTATION,35.01,6600000000,1293600000000.0,Corporation,Local
BUDIONO TANBUN,PSGO,PALMA SERASIH Tbk,PLANTATION,8.49,1600000000,313600000000.0,Individual,Local
BANK OF SINGAPORE LIMITED,PSGO,PALMA SERASIH Tbk,PLANTATION,3.52,662933333,129934933268.0,Insurance/Pension,Foreign
KELVIN HALIM,PSGO,PALMA SERASIH Tbk,PLANTATION,3.19,601400000,117874400000.0,Individual,Local
"CHE WAI CHAN,",PSGO,PALMA SERASIH Tbk,PLANTATION,2.65,500000000,98000000000.0,Individual,Foreign
DBS BANK LTD.,PSGO,PALMA SERASIH Tbk,PLANTATION,1.59,298780500,58560978000.0,Insurance/Pension,Foreign
PT TIRTA ORISA YASA,PSKT,RED PLANET INDONESIA Tbk,"RESTAURANT, HOTEL & TOURISM",40.77,4219825598,1029637445912.0,Corporation,Local
MOH.A.R.P.MANGKUNINGRAT,PSKT,RED PLANET INDONESIA Tbk,"RESTAURANT, HOTEL & TOURISM",22.46,2325081078,567319783032.0,Individual,Local
PT CRIO INDONESIA,PSKT,RED PLANET INDONESIA Tbk,"RESTAURANT, HOTEL & TOURISM",9.6,994207500,242586630000.0,Corporation,Local
PT. TRAJECTIVE MITRA INDONESIA,PSKT,RED PLANET INDONESIA Tbk,"RESTAURANT, HOTEL & TOURISM",7.3,756000000,184464000000.0,Corporation,Local
ALBERT KURNIAWAN BUDI S,PSKT,RED PLANET INDONESIA Tbk,"RESTAURANT, HOTEL & TOURISM",2.91,301210500,73495362000.0,Individual,Local
PT BERLIAN TAMBANG INDONESIA,PSKT,RED PLANET INDONESIA Tbk,"RESTAURANT, HOTEL & TOURISM",1.4,145274100,35446880400.0,Corporation,Local
PT. CIPTA KOMUNIKA KHATULISTIWA,PSKT,RED PLANET INDONESIA Tbk,"RESTAURANT, HOTEL & TOURISM",1.03,107103300,26133205200.0,Corporation,Local
PT INDOPRIMA MARINE,PSSI,IMC PELITA LOGISTIK Tbk,TRANSPORTATION,43.83,2374400000,826291200000.0,Corporation,Local
Kendilo Pte Ltd,PSSI,IMC PELITA LOGISTIK Tbk,TRANSPORTATION,28.12,1523190946,530070449208.0,Corporation,Foreign
PT BIO PERMAI,PSSI,IMC PELITA LOGISTIK Tbk,TRANSPORTATION,6.14,332686100,115774762800.0,Corporation,Local
PT IMC PELITA LOGISTIK TBK,PSSI,IMC PELITA LOGISTIK Tbk,TRANSPORTATION,5.46,295874000,102964152000.0,Corporation,Local
CONVIVIAL NAVIGATION CO. PTE.LTD,PSSI,IMC PELITA LOGISTIK Tbk,TRANSPORTATION,4.94,267863153,93216377244.0,Corporation,Foreign
TSAO PAO CHEE INVESTMENT MANAGEMENT PTE.LTD,PSSI,IMC PELITA LOGISTIK Tbk,TRANSPORTATION,4.43,240000000,83520000000.0,Corporation,Foreign
IMC DYNAMIC INVESTMENTS PTE LTD,PSSI,IMC PELITA LOGISTIK Tbk,TRANSPORTATION,4.43,240000000,83520000000.0,Corporation,Foreign
PERUSAHAAN PERSEROAN (PERSERO) PT MINERAL INDUSTRI INDONESIA,PTBA,BUKIT ASAM (PERSERO) Tbk,COAL MINING,65.93,7595650695,24154169210100.0,Corporation,Local
DJS KETENAGAKERJAAN PROGRAM JAMINAN HARI TUA,PTBA,BUKIT ASAM (PERSERO) Tbk,COAL MINING,1.54,177167100,563391378000.0,Insurance,Local
PT TEKNINDO GEOSISTEM UNGGUL,PTDU,DJASA UBERSAKTI Tbk,CONSTRUCTION,41.67,625000000,43750000000.0,Corporation,Local
RSK INVESTASI UNGGUL,PTDU,DJASA UBERSAKTI Tbk,CONSTRUCTION,31.67,475000000,33250000000.0,Corporation,Local
VICA VALENTINA,PTDU,DJASA UBERSAKTI Tbk,CONSTRUCTION,1.27,19000000,1330000000.0,Individual,Local
SUMIRAH TOHIR T,PTDU,DJASA UBERSAKTI Tbk,CONSTRUCTION,1.14,17044800,1193136000.0,Individual,Local
BUDIANTO M KURNIAWAN,PTDU,DJASA UBERSAKTI Tbk,CONSTRUCTION,1.03,15430800,1080156000.0,Individual,Local
STRAITS CORPORATION PTE LTD,PTIS,INDO STRAITS Tbk,TRANSPORTATION,81.82,450165300,135049590000.0,Unknown,Foreign
PHILLIP SECURITIES PTE LTD,PTIS,INDO STRAITS Tbk,TRANSPORTATION,3.42,18832600,5649780000.0,Securities Co,Foreign
ASURANSI SIMAS JIWA,PTIS,INDO STRAITS Tbk,TRANSPORTATION,2.3,12675100,3802530000.0,Insurance,Local
PT INDO STRAITS Tbk,PTIS,INDO STRAITS Tbk,TRANSPORTATION,1.17,6429000,1928700000.0,Corporation,Local
ANTHONY SETIADI,PTIS,INDO STRAITS Tbk,TRANSPORTATION,1.14,6248500,1874550000.0,Individual,Local
PT KENCANA USAHA SENTOSA,PTMP,MITRA PACK Tbk,OTHER - BASIC INDUSTRY AND CHEMICALS,72.51,2298124000,144781812000.0,Corporation,Local
PT. DIGITAL KODING SOLUSINDO,PTMP,MITRA PACK Tbk,OTHER - BASIC INDUSTRY AND CHEMICALS,2.81,89096800,5613098400.0,Corporation,Local
ARDI KUSUMA,PTMP,MITRA PACK Tbk,OTHER - BASIC INDUSTRY AND CHEMICALS,1.75,55555200,3499977600.0,Individual,Local
PT. MITRA TRI INVESTAMA,PTMP,MITRA PACK Tbk,OTHER - BASIC INDUSTRY AND CHEMICALS,1.34,42548300,2680542900.0,Corporation,Local
PT MITRA PACK Tbk,PTMR,MASTER PRINT Tbk,PLASTICS & PACKAGING,76.42,1457280000,545022720000.0,Corporation,Local
PT. MITRA TRI INVESTAMA,PTMR,MASTER PRINT Tbk,PLASTICS & PACKAGING,4.63,88272300,33013840200.0,Corporation,Local
PT MULTI MITRA SEMESTA,PTMR,MASTER PRINT Tbk,PLASTICS & PACKAGING,3.18,60732700,22714029800.0,Corporation,Local
PT. KURNIA SEMESTA PERSADA,PTMR,MASTER PRINT Tbk,PLASTICS & PACKAGING,2.37,45187300,16900050200.0,Corporation,Local
ROBERT HASAN,PTMR,MASTER PRINT Tbk,PLASTICS & PACKAGING,2.04,38909100,14552003400.0,Individual,Local
ELIT KARYA INVESTINDO PT,PTMR,MASTER PRINT Tbk,PLASTICS & PACKAGING,1.86,35540700,13292221800.0,Corporation,Local
EKO HERU WIBOWO,PTMR,MASTER PRINT Tbk,PLASTICS & PACKAGING,1.79,34187800,12786237200.0,Individual,Local
DONNY SANTOSA,PTMR,MASTER PRINT Tbk,PLASTICS & PACKAGING,1.23,23412100,8756125400.0,Individual,Local
PERUSAHAAN PERSEROAN (PERSERO) PT DANANTARA ASSET MANAGEMENT,PTPP,PP (PERSERO) Tbk,BUILDING CONSTRUCTION,50.49,3130328358,907795223820.0,Corporation,Local
DJS KETENAGAKERJAAN PROGRAM JAMINAN HARI TUA,PTPP,PP (PERSERO) Tbk,BUILDING CONSTRUCTION,3.39,210427800,61024062000.0,Insurance,Local
HAIYANTO,PTPP,PP (PERSERO) Tbk,BUILDING CONSTRUCTION,3.01,186627800,54122062000.0,Individual,Local
PT Phintraco Sekuritas,PTPP,PP (PERSERO) Tbk,BUILDING CONSTRUCTION,1.6,99088400,28735636000.0,Securities Co,Local
PT. MITRACOMM EKASARANA,PTPP,PP (PERSERO) Tbk,BUILDING CONSTRUCTION,1.52,94333200,27356628000.0,Corporation,Local
PT TASPEN (PERSERO),PTPP,PP (PERSERO) Tbk,BUILDING CONSTRUCTION,1.33,82298700,23866623000.0,Insurance,Local
DJS KETENAGAKERJAAN PROGRAM JAMINAN PENSIUN,PTPP,PP (PERSERO) Tbk,BUILDING CONSTRUCTION,1.02,63163900,18317531000.0,Insurance,Local
PT. SEKAWAN KONTRINDO,PTPS,PULAU SUBUR Tbk,OTHER - BASIC INDUSTRY AND CHEMICALS,78.54,1702400000,337075200000.0,Corporation,Local
ANDREAS WIDHATAMA KURNIAWAN,PTPW,PRATAMA WIDYA Tbk,BUILDING CONSTRUCTION,36.2,317925000,300439125000.0,Individual,Local
CYRILUS WINATAMA K,PTPW,PRATAMA WIDYA Tbk,BUILDING CONSTRUCTION,25.07,220125000,208018125000.0,Individual,Local
PT PRATAMA INVESTAMA KURNIA,PTPW,PRATAMA WIDYA Tbk,BUILDING CONSTRUCTION,10.42,91481900,86450395500.0,Corporation,Local
BONAVENTURA WIMATAMA KURNIAWAN,PTPW,PRATAMA WIDYA Tbk,BUILDING CONSTRUCTION,9.72,85375000,80679375000.0,Individual,Local
YOSEPH WIKATAMA,PTPW,PRATAMA WIDYA Tbk,BUILDING CONSTRUCTION,9.01,79125000,74773125000.0,Individual,Local
PT. ROYAL STRATEGIS KAPITAL,PTPW,PRATAMA WIDYA Tbk,BUILDING CONSTRUCTION,4.69,41168900,38904610500.0,Corporation,Local
PT. INVESTASI BERSAMA MANDIRI,PTPW,PRATAMA WIDYA Tbk,BUILDING CONSTRUCTION,3.66,32132500,30365212500.0,Corporation,Local
PT. KREASI JASA PERSADA,PTRO,PETROSEA Tbk,COAL MINING,45.33,4571811700,20344562065000.0,Corporation,Local
PT CARAKA REKSA OPTIMA,PTRO,PETROSEA Tbk,COAL MINING,24.45,2465974670,10973587281500.0,Corporation,Local
OCBC SECURITIES PRIVATE LIMITED,PTRO,PETROSEA Tbk,COAL MINING,2.69,271402100,1207739345000.0,Securities Co,Foreign
PT SENTOSA BERSAMA MITRA,PTRO,PETROSEA Tbk,COAL MINING,2.55,256892300,1143170735000.0,Corporation,Local
MORGAN STANLEY AND CO INTERNATIONAL PLC,PTRO,PETROSEA Tbk,COAL MINING,1.73,174964475,778591913750.0,Corporation,Foreign
PT PETRINDO JAYA KREASI TBK,PTRO,PETROSEA Tbk,COAL MINING,1.38,138926800,618224260000.0,Corporation,Local
ABIDIN FAN,PTSN,SAT NUSAPERSADA Tbk,ELECTRONICS,66.47,3532500000,1052685000000.0,Individual,Local
INDITECK TECHNOLOGY HONG KONG LIMITED,PTSN,SAT NUSAPERSADA Tbk,ELECTRONICS,10.0,531434400,158367451200.0,Corporation,Foreign
"ASUS INVESTMENT CO., LTD",PTSN,SAT NUSAPERSADA Tbk,ELECTRONICS,10.0,531434100,158367361800.0,Corporation,Foreign
PT ASUS INTERNATIONAL LIMITED,PTSN,SAT NUSAPERSADA Tbk,ELECTRONICS,4.91,260977800,77771384400.0,Corporation,Foreign
BIDIN YUSUF,PTSN,SAT NUSAPERSADA Tbk,ELECTRONICS,3.53,187680000,55928640000.0,Individual,Local
HARTO,PTSN,SAT NUSAPERSADA Tbk,ELECTRONICS,1.11,58968800,17572702400.0,Individual,Local
PT. GRAHA SENTOSA PERSADA,PTSP,PIONEERINDO GOURMET INTERNATIONAL Tbk,"RESTAURANT, HOTEL & TOURISM",27.63,61000666,52460572760.0,Corporation,Local
VP BANK LTD SINGAPORE BRANCH,PTSP,PIONEERINDO GOURMET INTERNATIONAL Tbk,"RESTAURANT, HOTEL & TOURISM",14.14,31214900,26844814000.0,Insurance/Pension,Foreign
"UNION BANCAIRE PRIVEE, UBP SA SINGAPORE BRANCH",PTSP,PIONEERINDO GOURMET INTERNATIONAL Tbk,"RESTAURANT, HOTEL & TOURISM",13.89,30674434,26380013240.0,Insurance/Pension,Foreign
PT. Bayu Buana Tbk,PTSP,PIONEERINDO GOURMET INTERNATIONAL Tbk,"RESTAURANT, HOTEL & TOURISM",8.9,19652000,16900720000.0,Corporation,Local
BANK OF SINGAPORE LIMITED,PTSP,PIONEERINDO GOURMET INTERNATIONAL Tbk,"RESTAURANT, HOTEL & TOURISM",8.05,17782720,15293139200.0,Insurance/Pension,Foreign
STANDARD CHARTERED BANK SG S/A VP BANK A/C SAPPHIRE LINK LTD (ID005464400008),PTSP,PIONEERINDO GOURMET INTERNATIONAL Tbk,"RESTAURANT, HOTEL & TOURISM",4.99,11020000,9477200000.0,Corporation,Foreign
STANDARD CHARTERED BANK SG S/A VP BANK A/C DIAMOND MILLENIUM LTD (ID005464400003),PTSP,PIONEERINDO GOURMET INTERNATIONAL Tbk,"RESTAURANT, HOTEL & TOURISM",4.98,11000000,9460000000.0,Corporation,Foreign
LGT BANK AG,PTSP,PIONEERINDO GOURMET INTERNATIONAL Tbk,"RESTAURANT, HOTEL & TOURISM",4.12,9095800,7822388000.0,Insurance/Pension,Foreign
CA INDOSUEZ (SWITZERLAND) SA,PTSP,PIONEERINDO GOURMET INTERNATIONAL Tbk,"RESTAURANT, HOTEL & TOURISM",4.04,8925080,7675568800.0,Insurance/Pension,Foreign
BANK JULIUS BAER & CO. LTD,PTSP,PIONEERINDO GOURMET INTERNATIONAL Tbk,"RESTAURANT, HOTEL & TOURISM",3.72,8206000,7057160000.0,Insurance/Pension,Foreign
BP2S SG/BNP PARIBAS SINGAPORE BRANCH WEALTH MANAGEMENT,PTSP,PIONEERINDO GOURMET INTERNATIONAL Tbk,"RESTAURANT, HOTEL & TOURISM",1.78,3929000,3378940000.0,Others,Foreign
PT. ISTANA KUTA RATU PRESTIGE,PUDP,PUDJIADI PRESTIGE Tbk,PROPERTY AND REAL ESTATE,44.54,293545682,98044257788.0,Corporation,Local
LENAWATI SETIADI P,PUDP,PUDJIADI PRESTIGE Tbk,PROPERTY AND REAL ESTATE,22.77,150093228,50131138152.0,Individual,Local
KOSMIAN PUDJIADI,PUDP,PUDJIADI PRESTIGE Tbk,PROPERTY AND REAL ESTATE,4.11,27076454,9043535636.0,Individual,Local
MARIANTI PUDJIADI,PUDP,PUDJIADI PRESTIGE Tbk,PROPERTY AND REAL ESTATE,4.11,27076454,9043535636.0,Individual,Local
KRISTIAN PUDJIADI,PUDP,PUDJIADI PRESTIGE Tbk,PROPERTY AND REAL ESTATE,4.1,27025256,9026435504.0,Individual,Local
LUKMAN PUDJIADI,PUDP,PUDJIADI PRESTIGE Tbk,PROPERTY AND REAL ESTATE,3.18,20984300,7008756200.0,Individual,Local
DAMIAN PUDJIADI,PUDP,PUDJIADI PRESTIGE Tbk,PROPERTY AND REAL ESTATE,2.83,18642778,6226687852.0,Individual,Local
CHENGWY KARLAM,PUDP,PUDJIADI PRESTIGE Tbk,PROPERTY AND REAL ESTATE,1.81,11949320,3991072880.0,Individual,Local
ARIYO TEJO,PUDP,PUDJIADI PRESTIGE Tbk,PROPERTY AND REAL ESTATE,1.34,8800806,2939469204.0,Individual,Local
PT GRAHA PUJI BAHANA,PUDP,PUDJIADI PRESTIGE Tbk,PROPERTY AND REAL ESTATE,1.27,8360854,2792525236.0,Corporation,Local
NATALIA DEVI PUDJIADI,PUDP,PUDJIADI PRESTIGE Tbk,PROPERTY AND REAL ESTATE,1.24,8166676,2727669784.0,Individual,Local
PT RAJAWALI INTI,PURA,PUTRA RAJAWALI KENCANA Tbk,TRANSPORTATION,15.28,962621880,27916034520.0,Corporation,Local
PT RAJAWALI DWIPUTRA INDONESIA,PURA,PUTRA RAJAWALI KENCANA Tbk,TRANSPORTATION,12.21,769639000,22319531000.0,Corporation,Local
PT IGELCORP ASIA KAPITAL,PURA,PUTRA RAJAWALI KENCANA Tbk,TRANSPORTATION,7.38,465006000,13485174000.0,Corporation,Local
PT IGELCORP NUSANTARA KAPITAL,PURA,PUTRA RAJAWALI KENCANA Tbk,TRANSPORTATION,5.6,353069900,10239027100.0,Corporation,Local
CGS INTERNATIONAL SECURITIES SINGAPORE PTE LTD,PURA,PUTRA RAJAWALI KENCANA Tbk,TRANSPORTATION,4.6,290159200,8414616800.0,Insurance/Pension,Foreign
NI MADE PUTRI UMBARAWATI SE,PURA,PUTRA RAJAWALI KENCANA Tbk,TRANSPORTATION,2.39,150888800,4375775200.0,Individual,Local
PT VARASH SADDAN NUSANTARA,PURA,PUTRA RAJAWALI KENCANA Tbk,TRANSPORTATION,2.07,130507300,3784711700.0,Corporation,Local
HENDRA PRAYITNO,PURA,PUTRA RAJAWALI KENCANA Tbk,TRANSPORTATION,1.98,124490900,3610236100.0,Individual,Local
ERWIN PRASETYA TJANDRA,PURA,PUTRA RAJAWALI KENCANA Tbk,TRANSPORTATION,1.9,120000000,3480000000.0,Individual,Local
I PUTU EKA SURYAWAN,PURA,PUTRA RAJAWALI KENCANA Tbk,TRANSPORTATION,1.8,113401100,3288631900.0,Individual,Local
TONNY HERMAWAN ADIKARJO IR,PURA,PUTRA RAJAWALI KENCANA Tbk,TRANSPORTATION,1.53,96163000,2788727000.0,Individual,Local
DHEERAJ,PURA,PUTRA RAJAWALI KENCANA Tbk,TRANSPORTATION,1.29,81590284,2366118236.0,Individual,Local
FACHRUL ATMADJA,PURA,PUTRA RAJAWALI KENCANA Tbk,TRANSPORTATION,1.26,79145900,2295231100.0,Individual,Local
SALIM LIM,PURA,PUTRA RAJAWALI KENCANA Tbk,TRANSPORTATION,1.14,72101100,2090931900.0,Individual,Local
TAN JANE,PURA,PUTRA RAJAWALI KENCANA Tbk,TRANSPORTATION,1.1,69371500,2011773500.0,Individual,Local
PT TRINITAN RESOURCETAMA INDONESIA,PURE,TRINITAN METALS AND MINERALS Tbk,METAL AND ALLIED PRODUCTS,26.45,363726830,18550068330.0,Corporation,Local
PT MIRAE ASSET SEKURITAS INDONESIA,PURE,TRINITAN METALS AND MINERALS Tbk,METAL AND ALLIED PRODUCTS,10.84,149102527,7604228877.0,Securities Co,Local
MELANIAWATI HADIKARTONO,PURE,TRINITAN METALS AND MINERALS Tbk,METAL AND ALLIED PRODUCTS,3.64,50100033,2555101683.0,Individual,Local
PUI SIAT HA,PURE,TRINITAN METALS AND MINERALS Tbk,METAL AND ALLIED PRODUCTS,2.84,39122900,1995267900.0,Individual,Local
WEMPY,PURE,TRINITAN METALS AND MINERALS Tbk,METAL AND ALLIED PRODUCTS,1.36,18684800,952924800.0,Individual,Local
REZANANTA F PIETRUSCHKA,PURE,TRINITAN METALS AND MINERALS Tbk,METAL AND ALLIED PRODUCTS,1.21,16600000,846600000.0,Individual,Local
ASHISH KUMAR D KESWANI,PURE,TRINITAN METALS AND MINERALS Tbk,METAL AND ALLIED PRODUCTS,1.13,15536100,792341100.0,Individual,Local
PT. BUMI KREASI BARU,PURI,PURI GLOBAL SUKSES Tbk,PROPERTY AND REAL ESTATE,76.8,768000000,110592000000.0,Corporation,Local
ONG YICK SING,PURI,PURI GLOBAL SUKSES Tbk,PROPERTY AND REAL ESTATE,5.15,51470500,7411752000.0,Individual,Foreign
PT PAKUWON ARTHANIAGA,PWON,PAKUWON JATI Tbk,PROPERTY AND REAL ESTATE,68.68,33077598400,11180228259200.0,Corporation,Local
EMPLOYEES PROVIDENT FUND BOARD,PWON,PAKUWON JATI Tbk,PROPERTY AND REAL ESTATE,2.29,1102803500,372747583000.0,Pension Fund,Foreign
FIDELITY FUNDS,PWON,PAKUWON JATI Tbk,PROPERTY AND REAL ESTATE,1.94,933435200,315501097600.0,Mutual Fund,Foreign
PLATINUM ASIA FUND,PWON,PAKUWON JATI Tbk,PROPERTY AND REAL ESTATE,1.5,724784985,244977324930.0,Mutual Fund,Foreign
REJUVE GLOBAL INVESTMENT PTE LTD,PYFA,PYRIDAM FARMA Tbk,PHARMACEUTICALS,64.02,7194080948,2230165093880.0,Corporation,Foreign
PT ASURANSI JIWA STARINVESTAMA,PYFA,PYRIDAM FARMA Tbk,PHARMACEUTICALS,5.1,572628400,177514804000.0,Insurance,Local
DBS BANK LTD.,PYFA,PYRIDAM FARMA Tbk,PHARMACEUTICALS,3.19,358078971,111004481010.0,Insurance/Pension,Foreign
PT ALDIRACITA SEKURITAS INDONESIA,PYFA,PYRIDAM FARMA Tbk,PHARMACEUTICALS,3.05,342863880,106287802800.0,Securities Co,Local
DIAN CIPTAMAS AGUNG PT,PYFA,PYRIDAM FARMA Tbk,PHARMACEUTICALS,1.03,115488400,35801404000.0,Corporation,Local
"Sriboga Raturaya, PT",PZZA,SARIMELATI KENCANA Tbk,FOOD & BEVERAGES,64.79,1957933250,375923184000.0,Corporation,Local
DBS BANK LTD S/A PEMBERTON ASIAN OPPORTUNITIES FUND,PZZA,SARIMELATI KENCANA Tbk,FOOD & BEVERAGES,9.6,290000000,55680000000.0,Insurance/Pension,Foreign
JPMCB NA AIF CLT RE-THE SCOTTISH ORIENTAL SMALLER COMPANIES TRUST PLC,PZZA,SARIMELATI KENCANA Tbk,FOOD & BEVERAGES,7.0,211533000,40614336000.0,Corporation,Foreign
CLSA LTD,PZZA,SARIMELATI KENCANA Tbk,FOOD & BEVERAGES,4.18,126353850,24259939200.0,Securities Co,Foreign
TJIOK ARISTO SUNGKONO.S,PZZA,SARIMELATI KENCANA Tbk,FOOD & BEVERAGES,1.57,47580000,9135360000.0,Individual,Local
RAM JETHMAL PUNJABI,RAAM,TRIPAR MULTIVSION PLUS Tbk,OTHERS - CONSUMER GOODS INDUSTRY,67.5,4599467382,975087084984.0,Individual,Local
PT. MNC DIGITAL ENTERTAINMENT TBK,RAAM,TRIPAR MULTIVSION PLUS Tbk,OTHERS - CONSUMER GOODS INDUSTRY,9.09,619420000,131317040000.0,Corporation,Local
SCOTTS CAPITAL INVESTMENT CORPORATION,RAAM,TRIPAR MULTIVSION PLUS Tbk,OTHERS - CONSUMER GOODS INDUSTRY,4.4,300000000,63600000000.0,Corporation,Foreign
LGT BANK AG,RAAM,TRIPAR MULTIVSION PLUS Tbk,OTHERS - CONSUMER GOODS INDUSTRY,2.45,167271400,35461536800.0,Insurance/Pension,Foreign
UOB KAY HIAN PRIVATE LIMITED,RAAM,TRIPAR MULTIVSION PLUS Tbk,OTHERS - CONSUMER GOODS INDUSTRY,2.21,150425500,31890206000.0,Securities Co,Foreign
CGS INTERNATIONAL SECURITIES SINGAPORE PTE LTD,RAAM,TRIPAR MULTIVSION PLUS Tbk,OTHERS - CONSUMER GOODS INDUSTRY,1.74,118694200,25163170400.0,Insurance/Pension,Foreign
REGENCY HIGH ENTERPRISE LTD,RAAM,TRIPAR MULTIVSION PLUS Tbk,OTHERS - CONSUMER GOODS INDUSTRY,1.51,102623000,21756076000.0,Corporation,Foreign
SAFARI ASIA LIMITED,RAAM,TRIPAR MULTIVSION PLUS Tbk,OTHERS - CONSUMER GOODS INDUSTRY,1.31,89500000,18974000000.0,Insurance/Pension,Foreign
GLOBALASIA CAPITAL INVESTAMA PT,RAFI,SARI KREASI BOGA Tbk,"OTHERS - TRADE, SERVICES & INVESTMENT",38.36,1200000000,43200000000.0,Others,Local
AGUSTIN WIDYAWATI,RAFI,SARI KREASI BOGA Tbk,"OTHERS - TRADE, SERVICES & INVESTMENT",4.92,154014600,5544525600.0,Individual,Local
gideon suryatika,RAFI,SARI KREASI BOGA Tbk,"OTHERS - TRADE, SERVICES & INVESTMENT",4.32,135041657,4861499652.0,Individual,Local
CHANDRA GUNAWAN,RAFI,SARI KREASI BOGA Tbk,"OTHERS - TRADE, SERVICES & INVESTMENT",3.8,118871600,4279377600.0,Individual,Local
SUSANNA HENDRO,RAFI,SARI KREASI BOGA Tbk,"OTHERS - TRADE, SERVICES & INVESTMENT",3.53,110384400,3973838400.0,Individual,Local
BATARA BAYU SOEDARWANTO,RAFI,SARI KREASI BOGA Tbk,"OTHERS - TRADE, SERVICES & INVESTMENT",2.26,70732200,2546359200.0,Individual,Local
YOHANES HALIM,RAFI,SARI KREASI BOGA Tbk,"OTHERS - TRADE, SERVICES & INVESTMENT",2.23,69601600,2505657600.0,Individual,Local
JOE S,RAFI,SARI KREASI BOGA Tbk,"OTHERS - TRADE, SERVICES & INVESTMENT",1.76,55050000,1981800000.0,Individual,Local
HO SIE FONG JOHN,RAFI,SARI KREASI BOGA Tbk,"OTHERS - TRADE, SERVICES & INVESTMENT",1.3,40532400,1459166400.0,Individual,Local
BASUNANDA BINTANG,RAFI,SARI KREASI BOGA Tbk,"OTHERS - TRADE, SERVICES & INVESTMENT",1.15,36000000,1296000000.0,Individual,Local
SUMITRO,RAFI,SARI KREASI BOGA Tbk,"OTHERS - TRADE, SERVICES & INVESTMENT",1.03,32220800,1159948800.0,Individual,Local
PT SENTOSA BERSAMA MITRA,RAJA,RUKUN RAHARJA Tbk,INVESTMENT COMPANY,35.45,1498372004,5439090374520.0,Corporation,Local
HAPSORO,RAJA,RUKUN RAHARJA Tbk,INVESTMENT COMPANY,27.52,1163236100,4222547043000.0,Individual,Local
PT TIRTA ORISA YASA,RAJA,RUKUN RAHARJA Tbk,INVESTMENT COMPANY,12.38,523174000,1899121620000.0,Corporation,Local
PT ZEZE AJUWEL TAMBANG,RAJA,RUKUN RAHARJA Tbk,INVESTMENT COMPANY,1.4,59040400,214316652000.0,Corporation,Local
PT RAMAYANA LESTARI SENTOSA,RALS,RAMAYANA LESTARI SENTOSA Tbk,RETAIL TRADE,13.55,961222700,428705324200.0,Corporation,Local
PAULUS TUMEWU,RALS,RAMAYANA LESTARI SENTOSA Tbk,RETAIL TRADE,3.66,260000000,115960000000.0,Individual,Local
PT RAMAYANA MAKMURSENTOSA,RALS,RAMAYANA LESTARI SENTOSA Tbk,RETAIL TRADE,58.74,4168513800,1859157154800.0,Corporation,Local
JAKARTA INTILAND PT,RALS,RAMAYANA LESTARI SENTOSA Tbk,RETAIL TRADE,2.2,156159200,69647003200.0,Corporation,Local
DRS LO KHENG HONG,RALS,RAMAYANA LESTARI SENTOSA Tbk,RETAIL TRADE,2.19,155351700,69286858200.0,Individual,Local
NT TST CO S/A EDGBASTON ASIAN EQUITY (JERSEY) TRUST,RALS,RAMAYANA LESTARI SENTOSA Tbk,RETAIL TRADE,1.11,78890100,35184984600.0,Others,Foreign
PT GLOBAL DIGITAL NIAGA TBK,RANC,SUPRA BOGA LESTARI Tbk,RETAIL TRADE,70.56,1103853228,596080743120.0,Corporation,Local
PT WIJAYA SUMBER SEJAHTERA,RANC,SUPRA BOGA LESTARI Tbk,RETAIL TRADE,11.83,185113597,99961342380.0,Corporation,Local
PT PRIMA RASA INTI,RANC,SUPRA BOGA LESTARI Tbk,RETAIL TRADE,5.76,90051343,48627725220.0,Corporation,Local
PT GUNAPRIMA KARYAPERKASA,RANC,SUPRA BOGA LESTARI Tbk,RETAIL TRADE,4.65,72730690,39274572600.0,Corporation,Local
PT EKAPUTRI MANDIRI,RANC,SUPRA BOGA LESTARI Tbk,RETAIL TRADE,2.32,36368112,19638780480.0,Corporation,Local
KENTJANA WIDJAJA,RANC,SUPRA BOGA LESTARI Tbk,RETAIL TRADE,1.27,19901400,10746756000.0,Individual,Local
RUKUN RAHARJA TBK,RATU,RAHARJA ENERGI CEPU Tbk,CRUDE PETROLEUM & NATURAL GAS PROD.,68.77,1867121000,9055536850000.0,Corporation,Local
CHANDRA DAYA INVESTASI,RATU,RAHARJA ENERGI CEPU Tbk,CRUDE PETROLEUM & NATURAL GAS PROD.,4.99,135481100,657083335000.0,Corporation,Local
MORGAN STANLEY AND CO INTERNATIONAL PLC,RATU,RAHARJA ENERGI CEPU Tbk,CRUDE PETROLEUM & NATURAL GAS PROD.,1.97,53529500,259618075000.0,Corporation,Foreign
PT PETRINDO JAYA KREASI TBK,RATU,RAHARJA ENERGI CEPU Tbk,CRUDE PETROLEUM & NATURAL GAS PROD.,1.63,44241200,214569820000.0,Corporation,Local
PETROSEA,RATU,RAHARJA ENERGI CEPU Tbk,CRUDE PETROLEUM & NATURAL GAS PROD.,1.28,34723300,168408005000.0,Corporation,Local
RICHARD R WIRIAHARDJA,RBMS,RISTIA BINTANG MAHKOTASEJATI Tbk,PROPERTY AND REAL ESTATE,51.88,1378060918,71659167736.0,Individual,Local
PT. RISTIA BMS CAPITAL,RBMS,RISTIA BINTANG MAHKOTASEJATI Tbk,PROPERTY AND REAL ESTATE,4.9,130089963,6764678076.0,Corporation,Local
REKSA DANA MINNA PADI INDRAPRASTHA SHM SYARIAH,RBMS,RISTIA BINTANG MAHKOTASEJATI Tbk,PROPERTY AND REAL ESTATE,4.82,127977200,6654814400.0,Mutual Fund,Local
PERUSAHAAN PERSEROAN (PERSERO) PT. ASABRI,RBMS,RISTIA BINTANG MAHKOTASEJATI Tbk,PROPERTY AND REAL ESTATE,4.66,123896700,6442628400.0,Insurance,Local
SIAUW YUNUS SUBANDI,RBMS,RISTIA BINTANG MAHKOTASEJATI Tbk,PROPERTY AND REAL ESTATE,1.66,44172825,2296986900.0,Individual,Local
AGUS PRAYITNO,RBMS,RISTIA BINTANG MAHKOTASEJATI Tbk,PROPERTY AND REAL ESTATE,1.11,29444700,1531124400.0,Individual,Local
PT ARTHA ERA PRIMAYASA,RBMS,RISTIA BINTANG MAHKOTASEJATI Tbk,PROPERTY AND REAL ESTATE,1.1,29224086,1519652472.0,Corporation,Local
ROY TJOKROWIDJOYO,RBMS,RISTIA BINTANG MAHKOTASEJATI Tbk,PROPERTY AND REAL ESTATE,1.01,26750300,1391015600.0,Individual,Local
PT. GELORA RIMBA JAYA,RCCC,UTAMA RADAR CAHAYA Tbk,TRANSPORTATION,77.92,613620000,66270960000.0,Corporation,Local
DAVID CHRISTIAN WAHYUDI SILAS,RCCC,UTAMA RADAR CAHAYA Tbk,TRANSPORTATION,2.56,20190520,2180576160.0,Individual,Local
DEDI JUSUF,RCCC,UTAMA RADAR CAHAYA Tbk,TRANSPORTATION,2.43,19165325,2069855100.0,Individual,Local
ADHITYA CHANDRA WIJAYA,RCCC,UTAMA RADAR CAHAYA Tbk,TRANSPORTATION,2.08,16380000,1769040000.0,Individual,Local
DANIEL ADI PRATIKTO,RCCC,UTAMA RADAR CAHAYA Tbk,TRANSPORTATION,2.06,16258825,1755953100.0,Individual,Local
HENRY ARDIAN SUTANTO,RCCC,UTAMA RADAR CAHAYA Tbk,TRANSPORTATION,1.75,13796575,1490030100.0,Individual,Local
YUKKY HARRY WIBOWO,RCCC,UTAMA RADAR CAHAYA Tbk,TRANSPORTATION,1.55,12219005,1319652540.0,Individual,Local
DIAN PRIYADI,RCCC,UTAMA RADAR CAHAYA Tbk,TRANSPORTATION,1.44,11354120,1226244960.0,Individual,Local
RUDY HARTONO,RCCC,UTAMA RADAR CAHAYA Tbk,TRANSPORTATION,1.32,10415095,1124830260.0,Individual,Local
SUTIADI WIDJAJA,RDTX,RODA VIVATEX Tbk,PROPERTY AND REAL ESTATE,42.51,114259300,1925269205000.0,Individual,Local
TURNIADY WIDJAJA,RDTX,RODA VIVATEX Tbk,PROPERTY AND REAL ESTATE,18.77,50444500,849989825000.0,Individual,Local
WIRIADY WIDJAJA,RDTX,RODA VIVATEX Tbk,PROPERTY AND REAL ESTATE,8.43,22659900,381819315000.0,Individual,Local
KARTA WIDJAJA,RDTX,RODA VIVATEX Tbk,PROPERTY AND REAL ESTATE,6.39,17182200,289520070000.0,Individual,Local
TENG GOAT NIO,RDTX,RODA VIVATEX Tbk,PROPERTY AND REAL ESTATE,4.98,13399000,225773150000.0,Individual,Local
YUNIASARI,RDTX,RODA VIVATEX Tbk,PROPERTY AND REAL ESTATE,4.82,12945800,218136730000.0,Individual,Local
HERRIJANTO WIDJAJA,RDTX,RODA VIVATEX Tbk,PROPERTY AND REAL ESTATE,2.73,7334500,123586325000.0,Individual,Local
HENDRY JONATHAN WIDJAJA,RDTX,RODA VIVATEX Tbk,PROPERTY AND REAL ESTATE,2.3,6186500,104242525000.0,Individual,Local
ANTHONNY WIDJAJA,RDTX,RODA VIVATEX Tbk,PROPERTY AND REAL ESTATE,2.26,6061800,102141330000.0,Individual,Local
GUNAWAN WIDJAYA,RDTX,RODA VIVATEX Tbk,PROPERTY AND REAL ESTATE,2.25,6052400,101982940000.0,Individual,Local
LANIWATI WIDJAJA,RDTX,RODA VIVATEX Tbk,PROPERTY AND REAL ESTATE,1.35,3624300,61069455000.0,Individual,Local
