investor,stock,company,sector,pct,shares,value_idr,type,lf
"GEMA KARYA INSAN, PT",CITY,NATURA CITY DEVELOPMENTS Tbk,PROPERTY AND REAL ESTATE,4.98,269000000,37929000000.0,Unknown,Foreign
PT ASA KENCANA MAKMUR,CITY,NATURA CITY DEVELOPMENTS Tbk,PROPERTY AND REAL ESTATE,4.92,266000000,37506000000.0,Unknown,Foreign
QUEEN BRIDGE INVESTMENTS LIMITED,CITY,NATURA CITY DEVELOPMENTS Tbk,PROPERTY AND REAL ESTATE,4.81,260000000,36660000000.0,Unknown,Foreign
PT GUNUNG NUSA INDAH,CITY,NATURA CITY DEVELOPMENTS Tbk,PROPERTY AND REAL ESTATE,4.94,267000000,37647000000.0,Unknown,Foreign
PT MANIKA ELOK CEMERLANG,CITY,NATURA CITY DEVELOPMENTS Tbk,PROPERTY AND REAL ESTATE,4.94,267000000,37647000000.0,Unknown,Foreign
PT SURYA CIPTA UTAMA,CITY,NATURA CITY DEVELOPMENTS Tbk,PROPERTY AND REAL ESTATE,4.83,261053000,36808473000.0,Unknown,Foreign
PT CAHAYA OBOR DAMAI,CITY,NATURA CITY DEVELOPMENTS Tbk,PROPERTY AND REAL ESTATE,4.35,235200000,33163200000.0,Corporation,Local
PT NUANSA INDAH KEMILAU,CITY,NATURA CITY DEVELOPMENTS Tbk,PROPERTY AND REAL ESTATE,3.93,212522000,29965602000.0,Corporation,Local
PT PACIFIK MANAGEMENT BUANA,CITY,NATURA CITY DEVELOPMENTS Tbk,PROPERTY AND REAL ESTATE,3.89,210000000,29610000000.0,Corporation,Local
PT ASA INSAN SAMPURNA,CITY,NATURA CITY DEVELOPMENTS Tbk,PROPERTY AND REAL ESTATE,4.9,265000000,37365000000.0,Unknown,Foreign
"MAHA GEMILANG SEJAHTERA, PT",CITY,NATURA CITY DEVELOPMENTS Tbk,PROPERTY AND REAL ESTATE,2.87,155225000,21886725000.0,Corporation,Local
CITRA PUTRA MANDIRI PT,CLAY,CITRA PUTRA REALTY Tbk,"RESTAURANT, HOTEL & TOURISM",77.77,1998750000,5776387500000.0,Unknown,Foreign
ABI HASNI TAHIR,CLAY,CITRA PUTRA REALTY Tbk,"RESTAURANT, HOTEL & TOURISM",4.75,122000000,352580000000.0,Individual,Local
DODI SUHARTONO ABDULKADIR,CLAY,CITRA PUTRA REALTY Tbk,"RESTAURANT, HOTEL & TOURISM",4.75,122000000,352580000000.0,Individual,Local
RUKI,CLAY,CITRA PUTRA REALTY Tbk,"RESTAURANT, HOTEL & TOURISM",4.55,117000000,338130000000.0,Individual,Local
ALBERT PHILIP,CLAY,CITRA PUTRA REALTY Tbk,"RESTAURANT, HOTEL & TOURISM",2.14,55065000,159137850000.0,Individual,Local
PUTRI SELARAS,CLAY,CITRA PUTRA REALTY Tbk,"RESTAURANT, HOTEL & TOURISM",1.99,51250000,148112500000.0,Individual,Local
PT BIOFUEL INDO SUMATRA,CLAY,CITRA PUTRA REALTY Tbk,"RESTAURANT, HOTEL & TOURISM",1.74,44843667,129598197630.0,Corporation,Local
RAJA SAPTA ERVIAN,CLAY,CITRA PUTRA REALTY Tbk,"RESTAURANT, HOTEL & TOURISM",1.64,42068266,121577288740.0,Individual,Local
PT. TANCORP GLOBAL ABADI,CLEO,SARIGUNA PRIMATIRTA Tbk,FOOD & BEVERAGES,56.12,13469824800,5360990270400.0,Corporation,Local
PT TANCORP GLOBAL SENTOSA,CLEO,SARIGUNA PRIMATIRTA Tbk,FOOD & BEVERAGES,21.09,5061400000,2014437200000.0,Corporation,Local
"TUDUNG PUTRA PUTRI JAYA, PT",CLEO,SARIGUNA PRIMATIRTA Tbk,FOOD & BEVERAGES,4.11,985757800,392331604400.0,Corporation,Local
PT. MULIA PRIMA TUNGGAL,CLEO,SARIGUNA PRIMATIRTA Tbk,FOOD & BEVERAGES,2.92,700000000,278600000000.0,Corporation,Local
"BERKAT NIRWANA SENTOSA, PT",CLEO,SARIGUNA PRIMATIRTA Tbk,FOOD & BEVERAGES,2.92,700000000,278600000000.0,Corporation,Local
DRS SURONO SUBEKTI,CLEO,SARIGUNA PRIMATIRTA Tbk,FOOD & BEVERAGES,1.22,292720000,116502560000.0,Individual,Local
PT. INK COLOR INT PTE.LTD WM CLIENT,CLPI,COLORPAK INDONESIA Tbk,CHEMICALS,51.0,156230000,244499950000.0,Corporation,Foreign
PT. BUKIT JAYA SEMESTA,CLPI,COLORPAK INDONESIA Tbk,CHEMICALS,7.43,22755300,35612044500.0,Corporation,Local
CHANDRA NATALIE WIDJAJA,CLPI,COLORPAK INDONESIA Tbk,CHEMICALS,6.65,20364500,31870442500.0,Individual,Local
SANTOSO JIEMY,CLPI,COLORPAK INDONESIA Tbk,CHEMICALS,3.97,12159000,19028835000.0,Individual,Local
TJIA HWIE TJIN,CLPI,COLORPAK INDONESIA Tbk,CHEMICALS,2.61,8000000,12520000000.0,Individual,Local
TJIA TJOEN HOK,CLPI,COLORPAK INDONESIA Tbk,CHEMICALS,2.24,6867700,10747950500.0,Individual,Local
SYLVIA INDRASARI NUGROHO,CLPI,COLORPAK INDONESIA Tbk,CHEMICALS,2.02,6190000,9687350000.0,Individual,Local
NITA WULANSARI NUGROHO,CLPI,COLORPAK INDONESIA Tbk,CHEMICALS,2.02,6190000,9687350000.0,Individual,Local
MARLON SUYANTHIO,CLPI,COLORPAK INDONESIA Tbk,CHEMICALS,1.51,4621800,7233117000.0,Individual,Local
SUTRISNO,CLPI,COLORPAK INDONESIA Tbk,CHEMICALS,1.19,3642100,5699886500.0,Individual,Local
WINARDI PRANATAJAYA,CLPI,COLORPAK INDONESIA Tbk,CHEMICALS,1.03,3141000,4915665000.0,Individual,Local
RICKY DONALS,CLPI,COLORPAK INDONESIA Tbk,CHEMICALS,1.01,3106500,4861672500.0,Individual,Local
BP2S SG/BNP PARIBAS SINGAPORE BRANCH WEALTH MANAGEMENT,CMNP,CITRA MARGA NUSAPHALA PERSADA Tbk,"TOLL ROAD, AIRPORT, HARBOR & ALLIED PROD.",59.35,3974436274,5603955146340.0,Others,Foreign
FEISAL HAMKA,CMNP,CITRA MARGA NUSAPHALA PERSADA Tbk,"TOLL ROAD, AIRPORT, HARBOR & ALLIED PROD.",5.0,335084474,472469108340.0,Individual,Local
LENA T BURHANUDIN,CMNP,CITRA MARGA NUSAPHALA PERSADA Tbk,"TOLL ROAD, AIRPORT, HARBOR & ALLIED PROD.",5.0,334559700,471729177000.0,Individual,Local
FITRIA YUSUF,CMNP,CITRA MARGA NUSAPHALA PERSADA Tbk,"TOLL ROAD, AIRPORT, HARBOR & ALLIED PROD.",4.99,334195400,471215514000.0,Individual,Local
FARID HAMKA,CMNP,CITRA MARGA NUSAPHALA PERSADA Tbk,"TOLL ROAD, AIRPORT, HARBOR & ALLIED PROD.",4.99,333828574,470698289340.0,Individual,Local
MERAH PUTIH INTERNATIONAL LIMITED,CMNP,CITRA MARGA NUSAPHALA PERSADA Tbk,"TOLL ROAD, AIRPORT, HARBOR & ALLIED PROD.",4.96,331989901,468105760410.0,Corporation,Foreign
MOHAMAD JUSUF HAMKA,CMNP,CITRA MARGA NUSAPHALA PERSADA Tbk,"TOLL ROAD, AIRPORT, HARBOR & ALLIED PROD.",4.03,269630196,380178576360.0,Individual,Local
ENDANG LESTARI PUJIASTUTI,CMNP,CITRA MARGA NUSAPHALA PERSADA Tbk,"TOLL ROAD, AIRPORT, HARBOR & ALLIED PROD.",3.59,240144250,338603392500.0,Individual,Local
IEVAN DANIAR SUMAMPOW,CMNP,CITRA MARGA NUSAPHALA PERSADA Tbk,"TOLL ROAD, AIRPORT, HARBOR & ALLIED PROD.",2.5,167076500,235577865000.0,Individual,Local
AGUS WIDAGDO,CMNP,CITRA MARGA NUSAPHALA PERSADA Tbk,"TOLL ROAD, AIRPORT, HARBOR & ALLIED PROD.",2.21,147930750,208582357500.0,Individual,Local
IEFENN ADRIANNE SUMAMPOW,CMNP,CITRA MARGA NUSAPHALA PERSADA Tbk,"TOLL ROAD, AIRPORT, HARBOR & ALLIED PROD.",1.29,86212220,121559230200.0,Individual,Local
WH INVESTMENTS PTE. LTD.,CMNT,CEMINDO GEMILANG Tbk,"OTHERS - INFRASTRUCTURE, UTILITIES & TRANSPORTATIO",87.37,14962904000,11222178000000.0,Corporation,Foreign
CHINA PARADISE H.K. LIMITED,CMNT,CEMINDO GEMILANG Tbk,"OTHERS - INFRASTRUCTURE, UTILITIES & TRANSPORTATIO",3.17,542451000,406838250000.0,Corporation,Foreign
GRANDHAM LIMITED,CMNT,CEMINDO GEMILANG Tbk,"OTHERS - INFRASTRUCTURE, UTILITIES & TRANSPORTATIO",3.05,521564100,391173075000.0,Corporation,Foreign
"SURYA TENGGARA BUANA, PT",CMNT,CEMINDO GEMILANG Tbk,"OTHERS - INFRASTRUCTURE, UTILITIES & TRANSPORTATIO",2.07,353800800,265350600000.0,Corporation,Local
UBS AG SINGAPORE BRANCH,CMNT,CEMINDO GEMILANG Tbk,"OTHERS - INFRASTRUCTURE, UTILITIES & TRANSPORTATIO",1.73,296069700,222052275000.0,Insurance/Pension,Foreign
PT GAMA GROUP,CMNT,CEMINDO GEMILANG Tbk,"OTHERS - INFRASTRUCTURE, UTILITIES & TRANSPORTATIO",1.11,190000000,142500000000.0,Corporation,Local
AIRASIA AVIATION GROUP LIMITED,CMPP,AIRASIA INDONESIA Tbk,TRANSPORTATION,46.25,4942013300,425013143800.0,Corporation,Foreign
PT. FERSINDO NUSAPERKASA,CMPP,AIRASIA INDONESIA Tbk,TRANSPORTATION,46.16,4931915000,424144690000.0,Corporation,Local
PT DANATAMA MAKMUR SEKURITAS,CMPP,AIRASIA INDONESIA Tbk,TRANSPORTATION,3.74,400000000,34400000000.0,Securities Co,Local
BAMBANG SUTANTIO,CMRY,CISARUA MOUNTAIN DAIRY Tbk,FOOD & BEVERAGES,53.56,4250000000,18445000000000.0,Individual,Local
FARELL GRANDISURI,CMRY,CISARUA MOUNTAIN DAIRY Tbk,FOOD & BEVERAGES,7.67,608558900,2641145626000.0,Individual,Local
WENZEL SUTANTIO,CMRY,CISARUA MOUNTAIN DAIRY Tbk,FOOD & BEVERAGES,7.08,561807600,2438244984000.0,Individual,Local
AXEL SUTANTIO,CMRY,CISARUA MOUNTAIN DAIRY Tbk,FOOD & BEVERAGES,6.77,537003200,2330593888000.0,Individual,Local
GENERAL ATLANTIC SINGAPORE CMR PTE. LTD.,CMRY,CISARUA MOUNTAIN DAIRY Tbk,FOOD & BEVERAGES,5.64,447777778,1943355556520.0,Corporation,Foreign
MITSUBISHI UFJ MORGAN STANLEY SECURITIES CO LTD-CLIENT ACCOUNT,CMRY,CISARUA MOUNTAIN DAIRY Tbk,FOOD & BEVERAGES,1.41,111945500,485843470000.0,Securities Co,Foreign
PT. PRUDENTIAL LIFE ASSURANCE,CMRY,CISARUA MOUNTAIN DAIRY Tbk,FOOD & BEVERAGES,1.04,82302000,357190680000.0,Insurance,Local
ANDERSON BAY PTE LTD,CNKO,EXPLOITASI ENERGI INDONESIA Tbk,WHOLESALE (DURABLE & NON DURABLE GOODS),45.59,4083459543,261341410752.0,Corporation,Foreign
ALAN KUNTJORO,CNKO,EXPLOITASI ENERGI INDONESIA Tbk,WHOLESALE (DURABLE & NON DURABLE GOODS),2.0,179300000,11475200000.0,Individual,Local
PT SAIBATAMA INTERNASIONAL MANDIRI,CNKO,EXPLOITASI ENERGI INDONESIA Tbk,WHOLESALE (DURABLE & NON DURABLE GOODS),1.95,174285211,11154253504.0,Corporation,Local
NIXON JACOBUS SILFANUS,CNKO,EXPLOITASI ENERGI INDONESIA Tbk,WHOLESALE (DURABLE & NON DURABLE GOODS),1.82,163219100,10446022400.0,Individual,Local
VIVI GUNAWAN,CNKO,EXPLOITASI ENERGI INDONESIA Tbk,WHOLESALE (DURABLE & NON DURABLE GOODS),1.67,150000000,9600000000.0,Individual,Local
PT. HARKATJAYA BUMIPERSADA,CNMA,NUSANTARA SEJAHTERA RAYA Tbk,OTHERS - CONSUMER GOODS INDUSTRY,53.99,45000000000,4815000000000.0,Corporation,Local
SALWEEN INVESTMENT PTE LTD,CNMA,NUSANTARA SEJAHTERA RAYA Tbk,OTHERS - CONSUMER GOODS INDUSTRY,22.51,18760000000,2007320000000.0,Corporation,Foreign
PT ADI PRATAMA NUSANTARA,CNMA,NUSANTARA SEJAHTERA RAYA Tbk,OTHERS - CONSUMER GOODS INDUSTRY,13.5,11250000000,1203750000000.0,Corporation,Local
PT NUSANTARA SEJAHTERA RAYA TBK,CNMA,NUSANTARA SEJAHTERA RAYA Tbk,OTHERS - CONSUMER GOODS INDUSTRY,2.04,1698015400,181687647800.0,Corporation,Local
ALBIZIA ASEAN TENGGARA FUND,CNMA,NUSANTARA SEJAHTERA RAYA Tbk,OTHERS - CONSUMER GOODS INDUSTRY,1.43,1188309900,127149159300.0,Corporation,Foreign
PT PROSPECT MOTOR,CNTX,CENTEX Tbk SERI A PREFEREN,"TEXTILE, GARMENT",34.2,23941000,3399622000.0,Corporation,Local
PT EASTERNTEX,CNTX,CENTEX Tbk SERI A PREFEREN,"TEXTILE, GARMENT",29.0,20298000,2882316000.0,Unknown,Foreign
PENFABRIC SDN BERHAD,CNTX,CENTEX Tbk SERI A PREFEREN,"TEXTILE, GARMENT",16.49,11546054,1639539668.0,Corporation,Foreign
TORAY INDUSTRIES INC,CNTX,CENTEX Tbk SERI A PREFEREN,"TEXTILE, GARMENT",5.71,4000000,568000000.0,Unknown,Foreign
BUDIMAN KENCANA LESTARI,CNTX,CENTEX Tbk SERI A PREFEREN,"TEXTILE, GARMENT",4.73,3310000,470020000.0,Corporation,Local
USMAN,CNTX,CENTEX Tbk SERI A PREFEREN,"TEXTILE, GARMENT",2.58,1807800,256707600.0,Individual,Local
SUJAKA LAYS,COAL,BLACK DIAMOND RESOURCES Tbk,COAL MINING,31.93,1995789500,117751580500.0,Individual,Local
ARIE RINALDI,COAL,BLACK DIAMOND RESOURCES Tbk,COAL MINING,6.0,375000000,22125000000.0,Individual,Local
HERRY SEN,COAL,BLACK DIAMOND RESOURCES Tbk,COAL MINING,4.0,250000000,14750000000.0,Individual,Local
"SELUAS LAUTAN INDONESIA, PT",COAL,BLACK DIAMOND RESOURCES Tbk,COAL MINING,2.12,132188100,7799097900.0,Corporation,Local
YUDI SETIAWAN,COAL,BLACK DIAMOND RESOURCES Tbk,COAL MINING,1.42,88594800,5227093200.0,Individual,Local
CHRIST SOENOTO,COAL,BLACK DIAMOND RESOURCES Tbk,COAL MINING,1.26,78750000,4646250000.0,Individual,Local
MAHOGANY GLOBAL INVESTMENT PTE.LTD,COCO,WAHANA INTERFOOD NUSANTARA Tbk,FOOD & BEVERAGES,51.32,1826864604,595557860904.0,Corporation,Foreign
DBS BANK LTD.,COCO,WAHANA INTERFOOD NUSANTARA Tbk,FOOD & BEVERAGES,5.24,186514644,60803773944.0,Insurance/Pension,Foreign
MARUARAR SIRAIT,COCO,WAHANA INTERFOOD NUSANTARA Tbk,FOOD & BEVERAGES,3.31,117910500,38438823000.0,Individual,Local
IR. P. SUDARTO,COCO,WAHANA INTERFOOD NUSANTARA Tbk,FOOD & BEVERAGES,2.82,100299100,32697506600.0,Individual,Local
PT TRIMEGAH SEKURITAS INDONESIA TBK,COCO,WAHANA INTERFOOD NUSANTARA Tbk,FOOD & BEVERAGES,2.25,80000100,26080032600.0,Securities Co,Local
PT. PURI DAMAI SEJAHTERA,COCO,WAHANA INTERFOOD NUSANTARA Tbk,FOOD & BEVERAGES,2.23,79331100,25861938600.0,Corporation,Local
PT MITRA SAWIT BARU,COCO,WAHANA INTERFOOD NUSANTARA Tbk,FOOD & BEVERAGES,1.71,60907250,19855763500.0,Corporation,Local
PT. INTER JAYA CORPORA,COCO,WAHANA INTERFOOD NUSANTARA Tbk,FOOD & BEVERAGES,1.42,50605750,16497474500.0,Corporation,Local
LEE YAN GWAN,COCO,WAHANA INTERFOOD NUSANTARA Tbk,FOOD & BEVERAGES,1.35,47900000,15615400000.0,Individual,Foreign
ANTHONIO,COCO,WAHANA INTERFOOD NUSANTARA Tbk,FOOD & BEVERAGES,1.26,44856500,14623219000.0,Individual,Local
"MEGAH PERKASA INVESTINDO, PT",COIN,INDOKRIPTO KOIN SEMESTA Tbk,OTHERS - FINANCE,23.98,3527001000,3632811030000.0,Corporation,Local
"BAHANA NUSANTARA INDOJAYA, PT",COIN,INDOKRIPTO KOIN SEMESTA Tbk,OTHERS - FINANCE,19.93,2931249000,3019186470000.0,Corporation,Local
IR.H.BUDI MARDIONO,COIN,INDOKRIPTO KOIN SEMESTA Tbk,OTHERS - FINANCE,7.93,1166750000,1201752500000.0,Individual,Local
"TEKNOLOGI ANAK NUSANTARA, PT",COIN,INDOKRIPTO KOIN SEMESTA Tbk,OTHERS - FINANCE,5.1,750000000,772500000000.0,Corporation,Local
"GRAHA PUTRA MENTARI, PT",COIN,INDOKRIPTO KOIN SEMESTA Tbk,OTHERS - FINANCE,3.4,500000000,515000000000.0,Corporation,Local
"CAKRAWALA INDOTAMA ABADI, PT",COIN,INDOKRIPTO KOIN SEMESTA Tbk,OTHERS - FINANCE,3.4,500000000,515000000000.0,Corporation,Local
"DUTA PERKASA TEKNOLOGI, PT",COIN,INDOKRIPTO KOIN SEMESTA Tbk,OTHERS - FINANCE,3.4,500000000,515000000000.0,Corporation,Local
"FAJAR INFORMATIKA PERKASA, PT",COIN,INDOKRIPTO KOIN SEMESTA Tbk,OTHERS - FINANCE,3.4,500000000,515000000000.0,Corporation,Local
"HARMONI SENTOSA NUSANTARA, PT",COIN,INDOKRIPTO KOIN SEMESTA Tbk,OTHERS - FINANCE,3.4,500000000,515000000000.0,Corporation,Local
"MANTRA PERMATA SEJAHTERA, PT",COIN,INDOKRIPTO KOIN SEMESTA Tbk,OTHERS - FINANCE,3.19,468750000,482812500000.0,Corporation,Local
"SURYA DIGITAL GEMILANG, PT",COIN,INDOKRIPTO KOIN SEMESTA Tbk,OTHERS - FINANCE,3.19,468750000,482812500000.0,Corporation,Local
"ENERGI HARMONI PERKASA, PT",COIN,INDOKRIPTO KOIN SEMESTA Tbk,OTHERS - FINANCE,2.55,375000000,386250000000.0,Corporation,Local
"ARSARI NUSA INVESTAMA, PT",COIN,INDOKRIPTO KOIN SEMESTA Tbk,OTHERS - FINANCE,2.0,294117600,302941128000.0,Insurance/Pension,Local
PT. WASAMAS INVESTAMA NUSANTARA,COIN,INDOKRIPTO KOIN SEMESTA Tbk,OTHERS - FINANCE,1.38,202800000,208884000000.0,Corporation,Local
"SENTRA DANA KAPITAL, PT",COIN,INDOKRIPTO KOIN SEMESTA Tbk,OTHERS - FINANCE,1.27,187490000,193114700000.0,Corporation,Local
PT Gama Nusapala,COWL,COWELL DEVELOPMENT Tbk,PROPERTY AND REAL ESTATE,71.12,3464639204,173231960200.0,Corporation,Local
FERAL INVESTMENT INC,COWL,COWELL DEVELOPMENT Tbk,PROPERTY AND REAL ESTATE,14.35,699040539,34952026950.0,Corporation,Foreign
Earvin Limited,COWL,COWELL DEVELOPMENT Tbk,PROPERTY AND REAL ESTATE,8.12,395470500,19773525000.0,Corporation,Foreign
PT KRISTAL DAYA KENCANA,COWL,COWELL DEVELOPMENT Tbk,PROPERTY AND REAL ESTATE,2.27,110694600,5534730000.0,Corporation,Local
REKSA DANA EMCO MANTAP,COWL,COWELL DEVELOPMENT Tbk,PROPERTY AND REAL ESTATE,1.58,76758400,3837920000.0,Mutual Fund,Local
CHAROEN POKPHAND INDONESIA GROUP PT,CPIN,CHAROEN POKPHAND INDONESIA Tbk,ANIMAL FEED,55.53,9106385410,37336180181000.0,Corporation,Local
UBS AG SINGAPORE BRANCH,CPIN,CHAROEN POKPHAND INDONESIA Tbk,ANIMAL FEED,5.98,980766200,4021141420000.0,Insurance/Pension,Foreign
PT LEAP GLOBAL CAPITAL,CPIN,CHAROEN POKPHAND INDONESIA Tbk,ANIMAL FEED,4.69,768442400,3150613840000.0,Corporation,Local
DBS BANK LTD.,CPIN,CHAROEN POKPHAND INDONESIA Tbk,ANIMAL FEED,4.39,719421300,2949627330000.0,Insurance/Pension,Foreign
UNITED OVERSEAS BANK NOMINEES (PRIVATE) LIMITED,CPIN,CHAROEN POKPHAND INDONESIA Tbk,ANIMAL FEED,4.29,704137300,2886962930000.0,Corporation,Foreign
RBC SINGAPORE - CLIENTS A/C,CPIN,CHAROEN POKPHAND INDONESIA Tbk,ANIMAL FEED,4.16,681950000,2795995000000.0,Insurance/Pension,Foreign
BONHAM NOMINEES PTE LTD,CPIN,CHAROEN POKPHAND INDONESIA Tbk,ANIMAL FEED,3.13,512963540,2103150514000.0,Corporation,Foreign
UOB KAY HIAN PRIVATE LIMITED,CPIN,CHAROEN POKPHAND INDONESIA Tbk,ANIMAL FEED,2.39,392577420,1609567422000.0,Securities Co,Foreign
DJS KETENAGAKERJAAN PROGRAM JAMINAN PENSIUN,CPIN,CHAROEN POKPHAND INDONESIA Tbk,ANIMAL FEED,1.61,263754700,1081394270000.0,Insurance,Local
PT RDW GLOBAL INVESTASI d/h PT INDIGO SUPER MEKANIKA,CPRI,CAPRI NUSA SATU PROPERTI Tbk,PROPERTY AND REAL ESTATE,71.2,1732500000,86625000000.0,Unknown,Foreign
UOB KAY HIAN PRIVATE LIMITED,CPRI,CAPRI NUSA SATU PROPERTI Tbk,PROPERTY AND REAL ESTATE,4.87,118591000,5929550000.0,Securities Co,Foreign
REKSA DANA EMCO MANTAP,CPRI,CAPRI NUSA SATU PROPERTI Tbk,PROPERTY AND REAL ESTATE,1.53,37119200,1855960000.0,Mutual Fund,Local
PT CENTRAL PANGAN PRIMA,CPRO,CENTRAL PROTEINAPRIMA Tbk,FISHERY,45.15,26898933014,1425643449742.0,Corporation,Local
UOB KAY HIAN PRIVATE LIMITED,CPRO,CENTRAL PROTEINAPRIMA Tbk,FISHERY,4.87,2903900000,153906700000.0,Securities Co,Foreign
DBS BANK LTD.,CPRO,CENTRAL PROTEINAPRIMA Tbk,FISHERY,4.86,2894065000,153385445000.0,Insurance/Pension,Foreign
CGS INTERNATIONAL SECURITIES SINGAPORE PTE LTD,CPRO,CENTRAL PROTEINAPRIMA Tbk,FISHERY,4.67,2784823500,147595645500.0,Insurance/Pension,Foreign
UBS AG SINGAPORE BRANCH,CPRO,CENTRAL PROTEINAPRIMA Tbk,FISHERY,4.23,2521823600,133656650800.0,Insurance/Pension,Foreign
UOB KAY HIAN (HONG KONG) LTD,CPRO,CENTRAL PROTEINAPRIMA Tbk,FISHERY,4.07,2425500000,128551500000.0,Securities Co,Foreign
CITIBANK HONG KONG S/A PBG CLIENTS SG,CPRO,CENTRAL PROTEINAPRIMA Tbk,FISHERY,3.08,1832000000,97096000000.0,Insurance/Pension,Foreign
CHANDRA ANTOLIS,CPRO,CENTRAL PROTEINAPRIMA Tbk,FISHERY,1.42,846980300,44889955900.0,Individual,Local
GINDRA TARDY,CRAB,TOBA SURIMI INDUSTRIES Tbk,FOOD & BEVERAGES,26.04,507780000,107649360000.0,Individual,Local
BINTARNA TARDY,CRAB,TOBA SURIMI INDUSTRIES Tbk,FOOD & BEVERAGES,22.36,436112200,92455786400.0,Individual,Local
BUDI SATRIA TARDY,CRAB,TOBA SURIMI INDUSTRIES Tbk,FOOD & BEVERAGES,16.88,329195700,69789488400.0,Individual,Local
IRSAN SUDARGO,CRAB,TOBA SURIMI INDUSTRIES Tbk,FOOD & BEVERAGES,8.62,168012000,35618544000.0,Individual,Local
SIA LENG HONG ALIAS TONY,CRAB,TOBA SURIMI INDUSTRIES Tbk,FOOD & BEVERAGES,8.3,161928000,34328736000.0,Individual,Local
PT PRIMA ANDALAN SEKURITAS,CRAB,TOBA SURIMI INDUSTRIES Tbk,FOOD & BEVERAGES,3.25,63308400,13421380800.0,Corporation,Local
PT EQUITAS GLOBAL MANDIRI,CRAB,TOBA SURIMI INDUSTRIES Tbk,FOOD & BEVERAGES,3.15,61443300,13025979600.0,Corporation,Local
PT INTI DEXA INVESTINDO,CRAB,TOBA SURIMI INDUSTRIES Tbk,FOOD & BEVERAGES,3.15,61512500,13040650000.0,Corporation,Local
PT MINA PRIMA INVESTAMA,CRAB,TOBA SURIMI INDUSTRIES Tbk,FOOD & BEVERAGES,2.74,53407500,11322390000.0,Corporation,Local
ERMAN,CRAB,TOBA SURIMI INDUSTRIES Tbk,FOOD & BEVERAGES,2.4,46800000,9921600000.0,Individual,Local
RUDY WIJAYA,CRAB,TOBA SURIMI INDUSTRIES Tbk,FOOD & BEVERAGES,1.03,20005000,4241060000.0,Individual,Local
SHEILA MARIA TIWAN,CRSN,CARSURIN Tbk,OTHER SECTORS,50.04,1447139400,151949637000.0,Individual,Local
FLORA REGINA REGIAN,CRSN,CARSURIN Tbk,OTHER SECTORS,29.48,852624000,89525520000.0,Individual,Local
PT HYPERION PLUTUS PILAR,CRSN,CARSURIN Tbk,OTHER SECTORS,4.99,144300000,15151500000.0,Corporation,Local
PT. ATLAS ORION INTEGRITAS,CRSN,CARSURIN Tbk,OTHER SECTORS,4.98,144100000,15130500000.0,Corporation,Local
PT. MONTEZUMA AQUARIUS UTAMA,CRSN,CARSURIN Tbk,OTHER SECTORS,4.98,144000000,15120000000.0,Corporation,Local
BING MONIAGA,CRSN,CARSURIN Tbk,OTHER SECTORS,1.03,29820000,3131100000.0,Individual,Local
ANTONIUS GUNAWAN GHO,CRSN,CARSURIN Tbk,OTHER SECTORS,1.03,29731100,3121765500.0,Individual,Local
PT.BUANATATA ADISENTOSA,CSAP,CATUR SENTOSA ADIPRANA Tbk,RETAIL TRADE,32.01,1819108716,523903310208.0,Corporation,Local
SCG RETAIL HOLDING COMPANY LIMITED,CSAP,CATUR SENTOSA ADIPRANA Tbk,RETAIL TRADE,30.89,1755800091,505670426208.0,Corporation,Foreign
NTASIAN DISCOVERY MASTER FUND,CSAP,CATUR SENTOSA ADIPRANA Tbk,RETAIL TRADE,13.18,749033925,215721770400.0,Mutual Fund,Foreign
DBS BANK LTD S/A ALBIZIA ASEAN OPPORTUNITIES FUND,CSAP,CATUR SENTOSA ADIPRANA Tbk,RETAIL TRADE,10.0,568336263,163680843744.0,Insurance/Pension,Foreign
BUDYANTO TOTONG,CSAP,CATUR SENTOSA ADIPRANA Tbk,RETAIL TRADE,6.23,353893142,101921224896.0,Individual,Local
PT ANDALAN UTAMA BINTARA,CSIS,CAHAYASAKTI INVESTINDO SUKSES Tbk,PROPERTY AND REAL ESTATE,65.21,1193219559,181369372968.0,Corporation,Local
PT OLYMPIC KAPITAL EQUITY,CSIS,CAHAYASAKTI INVESTINDO SUKSES Tbk,PROPERTY AND REAL ESTATE,19.14,350232000,53235264000.0,Corporation,Local
LISA MUCHTAR,CSMI,CIPTA SELERA MURNI Tbk,"RESTAURANT, HOTEL & TOURISM",56.15,458200000,37572400000.0,Individual,Local
REKSA DANA SUCORINVEST EQUITY PRIMA FUND,CSMI,CIPTA SELERA MURNI Tbk,"RESTAURANT, HOTEL & TOURISM",4.91,40060200,3284936400.0,Mutual Fund,Local
REKSA DANA SUCORINVEST SAHAM DINAMIS,CSMI,CIPTA SELERA MURNI Tbk,"RESTAURANT, HOTEL & TOURISM",3.34,27252900,2234737800.0,Mutual Fund,Local
REKSA DANA SUCORINVEST SHARIA EQUITY FUND,CSMI,CIPTA SELERA MURNI Tbk,"RESTAURANT, HOTEL & TOURISM",2.48,20240900,1659753800.0,Mutual Fund,Local
CIPTA SWADAYA MURNI PT,CSMI,CIPTA SELERA MURNI Tbk,"RESTAURANT, HOTEL & TOURISM",2.13,17360400,1423552800.0,Corporation,Local
REKSA DANA BALANCED FUND SUCORINVEST ANAK PINTAR,CSMI,CIPTA SELERA MURNI Tbk,"RESTAURANT, HOTEL & TOURISM",1.91,15593000,1278626000.0,Mutual Fund,Local
EVIE T. KARISOH,CSMI,CIPTA SELERA MURNI Tbk,"RESTAURANT, HOTEL & TOURISM",1.63,13300000,1090600000.0,Individual,Local
KEVIN MULJONO,CSMI,CIPTA SELERA MURNI Tbk,"RESTAURANT, HOTEL & TOURISM",1.05,8546700,700829400.0,Individual,Local
PT VERDAN SAWIT LESTARI,CSRA,CISADANE SAWIT RAYA Tbk,PLANTATION,38.0,779000000,708890000000.0,Corporation,Local
PT SAPTA SAWIT LESTARI,CSRA,CISADANE SAWIT RAYA Tbk,PLANTATION,38.0,779000000,708890000000.0,Corporation,Local
ALLON SERVICES PTE LTD,CSRA,CISADANE SAWIT RAYA Tbk,PLANTATION,4.88,100000000,91000000000.0,Others,Foreign
PT CISADANE SAWIT RAYA,CSRA,CISADANE SAWIT RAYA Tbk,PLANTATION,4.64,95107100,86547461000.0,Corporation,Local
PT. SAWIT INTI PERKASA,CSRA,CISADANE SAWIT RAYA Tbk,PLANTATION,4.0,82000000,74620000000.0,Corporation,Local
JAMBOL IWANTO,CSRA,CISADANE SAWIT RAYA Tbk,PLANTATION,1.94,39763128,36184446480.0,Individual,Local
EXCELLARY CAPITAL PTE. LTD.,CSRA,CISADANE SAWIT RAYA Tbk,PLANTATION,1.83,37457972,34086754520.0,Others,Foreign
KESTREL WAVE INVESTMENT LTD,CTBN,CITRA TUBINDO Tbk,METAL AND ALLIED PRODUCTS,48.23,386029420,2277573578000.0,Corporation,Foreign
VALLOUREC TUBES,CTBN,CITRA TUBINDO Tbk,METAL AND ALLIED PRODUCTS,33.48,268000000,1581200000000.0,Corporation,Foreign
NIPPON STEEL CORPORATION,CTBN,CITRA TUBINDO Tbk,METAL AND ALLIED PRODUCTS,6.97,55816880,329319592000.0,Corporation,Foreign
NIPPON STEEL SINGAPORE PTE LTD,CTBN,CITRA TUBINDO Tbk,METAL AND ALLIED PRODUCTS,3.87,30954650,182632435000.0,Corporation,Foreign
Sumitomo Corporation,CTBN,CITRA TUBINDO Tbk,METAL AND ALLIED PRODUCTS,3.62,28968880,170916392000.0,Corporation,Foreign
SUMITOMO CORPORATION ASIA & OCEANIA PTE. LTD.,CTBN,CITRA TUBINDO Tbk,METAL AND ALLIED PRODUCTS,1.8,14414200,85043780000.0,Corporation,Foreign
BNP PARIBAS SECURITIES SERVICES JERSEY S/A NON TAX TREATY CLIENTS/TAXABLE (EUR),CTBN,CITRA TUBINDO Tbk,METAL AND ALLIED PRODUCTS,1.49,11890200,70152180000.0,Insurance/Pension,Foreign
PT. SANG PELOPOR,CTRA,CIPUTRA DEVELOPMENT Tbk,PROPERTY AND REAL ESTATE,53.31,9882123998,7016308038580.0,Corporation,Local
YIMMY STEPHANOES,CTRA,CIPUTRA DEVELOPMENT Tbk,PROPERTY AND REAL ESTATE,4.22,781655800,554975618000.0,Individual,Local
FIDELITY FUNDS,CTRA,CIPUTRA DEVELOPMENT Tbk,PROPERTY AND REAL ESTATE,3.62,670865400,476314434000.0,Mutual Fund,Foreign
GOVERNMENT OF NORWAY,CTRA,CIPUTRA DEVELOPMENT Tbk,PROPERTY AND REAL ESTATE,2.05,380637197,270252409870.0,Others,Foreign
PT. ARENABINA MAKARTI,CTRA,CIPUTRA DEVELOPMENT Tbk,PROPERTY AND REAL ESTATE,1.62,301000000,213710000000.0,Corporation,Local
DJS KETENAGAKERJAAN PROGRAM JAMINAN HARI TUA,CTRA,CIPUTRA DEVELOPMENT Tbk,PROPERTY AND REAL ESTATE,1.51,279939500,198757045000.0,Insurance,Local
JPMCB NA AIF CLT RE-FIDELITY ASIAN VALUES PLC,CTRA,CIPUTRA DEVELOPMENT Tbk,PROPERTY AND REAL ESTATE,1.13,208812200,148256662000.0,Mutual Fund,Foreign
PARALLAX VENTURE PARTNERS XIII LTD,CTTH,CITATAH Tbk,LAND/STONE QUARRYING,18.9,232618891,16515941261.0,Unknown,Foreign
UOB KAY HIAN PRIVATE LIMITED,CTTH,CITATAH Tbk,LAND/STONE QUARRYING,9.4,115735348,8217209708.0,Securities Co,Foreign
TAUFIK JOHANNES,CTTH,CITATAH Tbk,LAND/STONE QUARRYING,8.61,105992999,7525502929.0,Individual,Local
ADVANCE CAPITAL LIMITED,CTTH,CITATAH Tbk,LAND/STONE QUARRYING,7.03,86472558,6139551618.0,Unknown,Foreign
MERIDIAN-PACIFIC INTERNATIONAL PTE LTD,CTTH,CITATAH Tbk,LAND/STONE QUARRYING,5.51,67777000,4812167000.0,Unknown,Foreign
Investspring Limited,CTTH,CITATAH Tbk,LAND/STONE QUARRYING,5.26,64800681,4600848351.0,Corporation,Foreign
Hexagon International Worldwide Ltd.,CTTH,CITATAH Tbk,LAND/STONE QUARRYING,4.94,60842830,4319840930.0,Others,Foreign
WONG HWA JIN,CTTH,CITATAH Tbk,LAND/STONE QUARRYING,4.71,58002500,4118177500.0,Individual,Local
KANTOR PUSAT DJKN DITJEN KEKAYAAN NEGARA KEMENTRIAN KEUANGAN,CTTH,CITATAH Tbk,LAND/STONE QUARRYING,4.28,52725864,3743536344.0,Others,Local
JIMMY SIANTO,CTTH,CITATAH Tbk,LAND/STONE QUARRYING,2.42,29767275,2113476525.0,Individual,Local
DENISE JOHANES,CTTH,CITATAH Tbk,LAND/STONE QUARRYING,1.02,12600000,894600000.0,Individual,Local
PRAJOGO PANGESTU,CUAN,PETRINDO JAYA KREASI Tbk,OTHER - BASIC INDUSTRY AND CHEMICALS,5.02,5645245000,5983959700000.0,Individual,Local
"GRANGE PROSPERITY PTE, LTD",CUAN,PETRINDO JAYA KREASI Tbk,OTHER - BASIC INDUSTRY AND CHEMICALS,2.63,2956589100,3133984446000.0,Corporation,Foreign
HSBC LTD-SINGAPORE BRANCH PRIVATE BANKING DIVISION ACCOUNT CLIENTS,CUAN,PETRINDO JAYA KREASI Tbk,OTHER - BASIC INDUSTRY AND CHEMICALS,1.09,1230116000,1303922960000.0,Corporation,Foreign
STANDARD CHARTERED BANK (SINGAPORE) LIMITED,CUAN,PETRINDO JAYA KREASI Tbk,OTHER - BASIC INDUSTRY AND CHEMICALS,1.02,1141185000,1209656100000.0,Insurance/Pension,Foreign
